FentyMascara,,,,,,,,
1738781940-274,https://www.sephora.com/product/fenty-hella-thicc-volumizing-mascara-P505055?skuId=2656130&icid2=products%20grid:p505055:product,1.2K,https://www.sephora.com/product/fenty-hella-thicc-volumizing-mascara-P505055?skuId=2656130&icid2=products%20grid:p505055:product#ratings-reviews-container,,New favorite mascara,10 Dec 2024,braeken,This is superior mascara. It is thin and buildable and makes my lashes look unbelievably long and thick. It is thinner than I am used to so I made sure to take some off of the brush and made sure to build instead of slapping a bunch on in one stroke. The brush coats lashes from root to tip.
1738781940-275,https://www.sephora.com/product/fenty-hella-thicc-volumizing-mascara-P505055?skuId=2656130&icid2=products%20grid:p505055:product,1.2K,https://www.sephora.com/product/fenty-hella-thicc-volumizing-mascara-P505055?skuId=2656130&icid2=products%20grid:p505055:product#ratings-reviews-container,,,10 Dec 2024,Somuriella,This mascara is hands down one of the BEST mascaras I’ve ever used. The wand is amazing not only for the top of my lashes but the bottom as well. It’s buildable and really adds volume and length to my lashes. The perfect mascara 10/10
1738781940-276,https://www.sephora.com/product/fenty-hella-thicc-volumizing-mascara-P505055?skuId=2656130&icid2=products%20grid:p505055:product,1.2K,https://www.sephora.com/product/fenty-hella-thicc-volumizing-mascara-P505055?skuId=2656130&icid2=products%20grid:p505055:product#ratings-reviews-container,,One coat only!,10 Dec 2024,bok88,"Ooh I’m torn on this one! Ii love how wet the formula is, and sleek. It is a bit messy, and I usually do not have any reactions to mascara, but my eyes were slightly irritated after a few hours, nothing terrible. I do not like that it was not a great experience trying to apply a second coat, one coat is nice id you can get away with one coat. I personally need a few coats, and that turns messy with this particular mascara. Lovely one coat."
1738781940-277,https://www.sephora.com/product/fenty-hella-thicc-volumizing-mascara-P505055?skuId=2656130&icid2=products%20grid:p505055:product,1.2K,https://www.sephora.com/product/fenty-hella-thicc-volumizing-mascara-P505055?skuId=2656130&icid2=products%20grid:p505055:product#ratings-reviews-container,,"Overall a nice, long lasting mascara!",10 Dec 2024,LorenDay,"I was excited to try the Fenty Hella Thicc Vilumizing Mascara and it worked well. I have pretty straight lashes and need to curl them in order to get the look I want, and after hours of wearing my lashes were unfortunately straight again. I may not have curled them well enough or put on enough mascara, so I’m willing to try it again because I think it is a nice, long lasting mascara! It’s a pretty waterproof even though that’s not advertised because it took a long time to remove it."
1738781940-278,https://www.sephora.com/product/fenty-hella-thicc-volumizing-mascara-P505055?skuId=2656130&icid2=products%20grid:p505055:product,1.2K,https://www.sephora.com/product/fenty-hella-thicc-volumizing-mascara-P505055?skuId=2656130&icid2=products%20grid:p505055:product#ratings-reviews-container,,Pretty Decent,9 Dec 2024,trtaylor,"I love the name of this product and it does live up to the name - Hella Thicc. My lashes did appear thicker after just one application. I really like the shape of the tube as well, it feels premium."
1738781940-279,https://www.sephora.com/product/fenty-hella-thicc-volumizing-mascara-P505055?skuId=2656130&icid2=products%20grid:p505055:product,1.2K,https://www.sephora.com/product/fenty-hella-thicc-volumizing-mascara-P505055?skuId=2656130&icid2=products%20grid:p505055:product#ratings-reviews-container,,"Volumizes, lengthens and curls my lashes very well",9 Dec 2024,nloach,"The packaging is chick, classy and durable. No scent.
Aoplication is easy and the wand seperates lashes very well. It Lengthened and curled my lashes beautifully. Also it gives good voluminous lashes and with this i dont need to wear lashes. Great performance according to the price point."
1738781940-280,https://www.sephora.com/product/fenty-hella-thicc-volumizing-mascara-P505055?skuId=2656130&icid2=products%20grid:p505055:product,1.2K,https://www.sephora.com/product/fenty-hella-thicc-volumizing-mascara-P505055?skuId=2656130&icid2=products%20grid:p505055:product#ratings-reviews-container,,It's a yes!,9 Dec 2024,dreamingofdelta,"Okay, Hella Thick mascara is amazing! It lasted all day without smudging or clumping, giving my lashes a bold, flawless look. Highly recommend!"
1738781940-281,https://www.sephora.com/product/fenty-hella-thicc-volumizing-mascara-P505055?skuId=2656130&icid2=products%20grid:p505055:product,1.2K,https://www.sephora.com/product/fenty-hella-thicc-volumizing-mascara-P505055?skuId=2656130&icid2=products%20grid:p505055:product#ratings-reviews-container,,Daily go to for work,9 Dec 2024,,"Let’s start with the pros- 
Classy and sassy packaging
Product design itself is sleek, classy, and unique
No heavy scent is a huge plus
Application was light and easy
It’s effective in spreading the lashes and having a clean look
The value is also pretty great honestly. It’s not overpriced

The cons- 
The packaging doesn’t state if it’s waterproof or not. 
It did run just a little with sweat, but not much at all and wasn’t really noticeable to anyone else.
I wish the wand was a little curved or spread out to really pull the length, but even so, it still did an amazing job. 


All in all I think this is a great product and over the last few days it has definitely become my go to for work days."
1738781940-282,https://www.sephora.com/product/fenty-hella-thicc-volumizing-mascara-P505055?skuId=2656130&icid2=products%20grid:p505055:product,1.2K,https://www.sephora.com/product/fenty-hella-thicc-volumizing-mascara-P505055?skuId=2656130&icid2=products%20grid:p505055:product#ratings-reviews-container,,It helps give my eyelashes so much volume,9 Dec 2024,Beauty2590,"This mascara helps give my eyelashes so much volume. I have very straight lashes so it’s hard to get them to look full. You don’t need that many coats, I only used about two and my eyelashes looked very voluminous. I like that the wand is very easy to work with as well."
1738781940-283,https://www.sephora.com/product/fenty-hella-thicc-volumizing-mascara-P505055?skuId=2656130&icid2=products%20grid:p505055:product,1.2K,https://www.sephora.com/product/fenty-hella-thicc-volumizing-mascara-P505055?skuId=2656130&icid2=products%20grid:p505055:product#ratings-reviews-container,,Good mascara,9 Dec 2024,EthelGrace22,"I am pleased with the added length that this mascara provides to my lashes. However, on occasion, I experience watery eyes which causes the mascara to run down my face. While it is easy to remove the mascara from my eyes, it becomes a challenge when my eyes are teary. Packaging is nice, there’s no scent."
1738781940-284,https://www.sephora.com/product/fenty-hella-thicc-volumizing-mascara-P505055?skuId=2656130&icid2=products%20grid:p505055:product,1.2K,https://www.sephora.com/product/fenty-hella-thicc-volumizing-mascara-P505055?skuId=2656130&icid2=products%20grid:p505055:product#ratings-reviews-container,,Love this mascara!,9 Dec 2024,BBCrans,This mascara is awesome! It makes my lashes look so long and doesn't clump them up at all. I love that the color is super black to really make my eyes pop. The brush works well to comb my eyelashes out and separate each one. I really like this mascara and would definitely buy it again. I have already recommended it to friends and family.
1738781940-285,https://www.sephora.com/product/fenty-hella-thicc-volumizing-mascara-P505055?skuId=2656130&icid2=products%20grid:p505055:product,1.2K,https://www.sephora.com/product/fenty-hella-thicc-volumizing-mascara-P505055?skuId=2656130&icid2=products%20grid:p505055:product#ratings-reviews-container,,It’s just ok,9 Dec 2024,JpRN1,I received this mascara complementary from influencer in exchange for my honest review. This is mascara is just ok. The formula seems a bit goopy so be careful not to let it transfer. It does thicken the lashes nicely and add some length but if you typically use two coats expect some clumps. It did however last all day and did not transfer once dry. Easy to wash off with makeup remover.
1738781940-286,https://www.sephora.com/product/fenty-hella-thicc-volumizing-mascara-P505055?skuId=2656130&icid2=products%20grid:p505055:product,1.2K,https://www.sephora.com/product/fenty-hella-thicc-volumizing-mascara-P505055?skuId=2656130&icid2=products%20grid:p505055:product#ratings-reviews-container,,Good product - stays on for a while,8 Dec 2024,remyas,I like the packaging. The wand is easy to hold and use. The color is good but I do feel that it clumps a little bit. I have to use an eye lash comb to separate out my lashes but this is true for most mascaras. All in all a good product.
1738781940-287,https://www.sephora.com/product/fenty-hella-thicc-volumizing-mascara-P505055?skuId=2656130&icid2=products%20grid:p505055:product,1.2K,https://www.sephora.com/product/fenty-hella-thicc-volumizing-mascara-P505055?skuId=2656130&icid2=products%20grid:p505055:product#ratings-reviews-container,,New fave!,8 Dec 2024,Pikaa,"This mascara is so dark, and I loved the volume and length it gave my lashes. I did not experience any flaking or smudging. This mascara lasted all day!"
1738781940-288,https://www.sephora.com/product/fenty-hella-thicc-volumizing-mascara-P505055?skuId=2656130&icid2=products%20grid:p505055:product,1.2K,https://www.sephora.com/product/fenty-hella-thicc-volumizing-mascara-P505055?skuId=2656130&icid2=products%20grid:p505055:product#ratings-reviews-container,,Great Easy To Wear Mascara,8 Dec 2024,SampleRaccoon,You get a lot of pay out with very little effort with this mascara. It really lifts your lashes. The brush is simple and effective and the tube feels nice in hand.  Definitely recommend.
1738781940-289,https://www.sephora.com/product/fenty-hella-thicc-volumizing-mascara-P505055?skuId=2656130&icid2=products%20grid:p505055:product,1.2K,https://www.sephora.com/product/fenty-hella-thicc-volumizing-mascara-P505055?skuId=2656130&icid2=products%20grid:p505055:product#ratings-reviews-container,,Works great,8 Dec 2024,mnguyen0929,"I heard the hype about this product - and um its amazing. The formula is not too sticky or too slick, barely any clumps even with a lash conditioner applied prior.  I was most skeptical about the brush, as typically my lashes won't cooperate but this was magical, highly recommend to my friends and family. This is by far my favorite mascara. It does not clump and fans out my lashes perfectly."
1738781940-290,https://www.sephora.com/product/fenty-hella-thicc-volumizing-mascara-P505055?skuId=2656130&icid2=products%20grid:p505055:product,1.2K,https://www.sephora.com/product/fenty-hella-thicc-volumizing-mascara-P505055?skuId=2656130&icid2=products%20grid:p505055:product#ratings-reviews-container,,Dry and impossible to remove,8 Dec 2024,,"I received this item as part of a promotion. I don’t like this at all. The formula feels very dry and flaky, and it does not go on smooth. I also found that removing it was nearly impossible. It’s not waterproof, but it would not come off my eyelashes even after scrubbing. I’m really let down by this and would not recommend."
1738781940-291,https://www.sephora.com/product/fenty-hella-thicc-volumizing-mascara-P505055?skuId=2656130&icid2=products%20grid:p505055:product,1.2K,https://www.sephora.com/product/fenty-hella-thicc-volumizing-mascara-P505055?skuId=2656130&icid2=products%20grid:p505055:product#ratings-reviews-container,,"If you want volume and lift, you need this mascara",8 Dec 2024,GiniRae,"Grateful to @influenster for sending me the @fentybeauty Hella Thicc Volumizing Mascara complimentary to try. The color Cuz I'm Black is a rich black that lasts all day without flaking or smudging. It adds lift and volume. The first time I used it there was no clumping at all. But the 2nd time the brush was full of clumps that transferred to my lashes. Once I wiped off the top and the brush it was fine. So I highly recommend doing that after each use. Other than that I do love it! As much as I liked her other one I like this even more. And the price is excellent too! I highly recommend it!
#influenster #fentybeauty #complimentary #honestreviews #volumizingmascara #makeupreview"
1738781940-292,https://www.sephora.com/product/fenty-hella-thicc-volumizing-mascara-P505055?skuId=2656130&icid2=products%20grid:p505055:product,1.2K,https://www.sephora.com/product/fenty-hella-thicc-volumizing-mascara-P505055?skuId=2656130&icid2=products%20grid:p505055:product#ratings-reviews-container,,Not the best of Fenty beauty,8 Dec 2024,Ruthiiiie,This mascara definitely volumizes but it smears really bad. If you do a full face after a few hours your under eyes will look black.
1738781940-293,https://www.sephora.com/product/fenty-hella-thicc-volumizing-mascara-P505055?skuId=2656130&icid2=products%20grid:p505055:product,1.2K,https://www.sephora.com/product/fenty-hella-thicc-volumizing-mascara-P505055?skuId=2656130&icid2=products%20grid:p505055:product#ratings-reviews-container,,works well!,8 Dec 2024,amyhab,"i really like this formula! i’m so picky when it comes to mascara, but this one held my lashes up. i used the clinique lash primer underneath and the fenty mascara on top, and it definitely held up."
1738781940-294,https://www.sephora.com/product/fenty-hella-thicc-volumizing-mascara-P505055?skuId=2656130&icid2=products%20grid:p505055:product,1.2K,https://www.sephora.com/product/fenty-hella-thicc-volumizing-mascara-P505055?skuId=2656130&icid2=products%20grid:p505055:product#ratings-reviews-container,,Lives up to its claims,7 Dec 2024,tif22408,"-I love this mascara! It lives up to what it claims. My lashes looked so full, thick, and black after I applied just one coat. The formula is drier which I actually prefer in a mascara. I think drier formula’s are easier to work with and there is less room for error for transferring during application. I applied this mascara on my top and bottom lashes. I Had no issues with clumping even when I built it up. It lasted all day without flaking or smudging. I will definitely continue to use and hope they come out with a brown shade."
1738781940-295,https://www.sephora.com/product/fenty-hella-thicc-volumizing-mascara-P505055?skuId=2656130&icid2=products%20grid:p505055:product,1.2K,https://www.sephora.com/product/fenty-hella-thicc-volumizing-mascara-P505055?skuId=2656130&icid2=products%20grid:p505055:product#ratings-reviews-container,,Length volume mascara,7 Dec 2024,jennym1234,I put this mascara on my bottom lashes and I do love how it looked. It made them stand out and they looked really dark and a good amount of length and volume. It did transfer a little.
1738781940-296,https://www.sephora.com/product/fenty-hella-thicc-volumizing-mascara-P505055?skuId=2656130&icid2=products%20grid:p505055:product,1.2K,https://www.sephora.com/product/fenty-hella-thicc-volumizing-mascara-P505055?skuId=2656130&icid2=products%20grid:p505055:product#ratings-reviews-container,,A must from Fenty!,7 Dec 2024,ahall11,"If I could rate this past a 10, I would. This mascara has gorgeous, sleek, modern packaging! The formula is super lightweight, but still gives you the FULLNESS you have always wanted! It is definitely worth the money considering it lasts for at least 8 hours, even with some crying!"
1738781940-297,https://www.sephora.com/product/fenty-hella-thicc-volumizing-mascara-P505055?skuId=2656130&icid2=products%20grid:p505055:product,1.2K,https://www.sephora.com/product/fenty-hella-thicc-volumizing-mascara-P505055?skuId=2656130&icid2=products%20grid:p505055:product#ratings-reviews-container,,"Good, but not my fave!",7 Dec 2024,AmberG07,"I really wanted to love this! The package is very try lightweight and the brush combs through nicely, but there is a lot of transfer to the lower lash area and it’s almost too liquidy. I think it will be better with use and once some air gets pumped into it. I love that it’s very black. Overall very pretty, but not the best mascara."
1738781940-298,https://www.sephora.com/product/fenty-hella-thicc-volumizing-mascara-P505055?skuId=2656130&icid2=products%20grid:p505055:product,1.2K,https://www.sephora.com/product/fenty-hella-thicc-volumizing-mascara-P505055?skuId=2656130&icid2=products%20grid:p505055:product#ratings-reviews-container,,Bold,7 Dec 2024,ucLena,"This mascara goes on the way I like it, not clumpy and looks best when built up in layers. The end results, as you see in my photos, beautiful lashes. I really do not have eye lashes, as you see, So thickening mascara is essential.  I do wish the wand had a curve, but that’s just my preference."
1738781940-299,https://www.sephora.com/product/fenty-hella-thicc-volumizing-mascara-P505055?skuId=2656130&icid2=products%20grid:p505055:product,1.2K,https://www.sephora.com/product/fenty-hella-thicc-volumizing-mascara-P505055?skuId=2656130&icid2=products%20grid:p505055:product#ratings-reviews-container,,Good Value Mascara for Everyday Use,7 Dec 2024,mw9999,"I’ve been testing this mascara for a couple weeks now and have had a great experience so far! The formula is not clumpy, the packaging is cute, and the price is great compared to other luxury mascara brands. The only negative that I could see, depending on your lifestyle, is that it’s not a waterproof mascara by any means. With water, it does run down. And I have noticed a little bit of flaking by the end of the day under my lashes. However, this has not been enough to deter me from using it daily. I may have to transition my everyday mascara to this one because of the great quality for the price!"
1738781940-300,https://www.sephora.com/product/fenty-hella-thicc-volumizing-mascara-P505055?skuId=2656130&icid2=products%20grid:p505055:product,1.2K,https://www.sephora.com/product/fenty-hella-thicc-volumizing-mascara-P505055?skuId=2656130&icid2=products%20grid:p505055:product#ratings-reviews-container,,Amazing mascara,7 Dec 2024,slaywithjessika,This mascara is amazing I love how the Bristle of the mascara  spreads out my lashes it looks amazing and it  won’t clump up what’s so ever. I highly recommend I. Love the dark black  shade it enhances my lashes more
1738781940-301,https://www.sephora.com/product/fenty-hella-thicc-volumizing-mascara-P505055?skuId=2656130&icid2=products%20grid:p505055:product,1.2K,https://www.sephora.com/product/fenty-hella-thicc-volumizing-mascara-P505055?skuId=2656130&icid2=products%20grid:p505055:product#ratings-reviews-container,,Yes!,7 Dec 2024,chris0315,Great mascar to use on a daily. Would highly recommend.
1738781940-302,https://www.sephora.com/product/fenty-hella-thicc-volumizing-mascara-P505055?skuId=2656130&icid2=products%20grid:p505055:product,1.2K,https://www.sephora.com/product/fenty-hella-thicc-volumizing-mascara-P505055?skuId=2656130&icid2=products%20grid:p505055:product#ratings-reviews-container,,Great mascara for little time periods,7 Dec 2024,chiaraa217,I love the results of this product but it doesn’t hold its shape for long but i still really like this product
1738781940-303,https://www.sephora.com/product/fenty-hella-thicc-volumizing-mascara-P505055?skuId=2656130&icid2=products%20grid:p505055:product,1.2K,https://www.sephora.com/product/fenty-hella-thicc-volumizing-mascara-P505055?skuId=2656130&icid2=products%20grid:p505055:product#ratings-reviews-container,,My Forever Go-To!,7 Dec 2024,RealShannanigan,"The Fenty Beauty by Rihanna Hella Thicc Volumizing Mascara is everything! It gives my lashes incredible volume and definition, making them look bold and stunning. This is my forever go-to mascara—absolutely obsessed! 🖤✨"
1738781940-304,https://www.sephora.com/product/fenty-hella-thicc-volumizing-mascara-P505055?skuId=2656130&icid2=products%20grid:p505055:product,1.2K,https://www.sephora.com/product/fenty-hella-thicc-volumizing-mascara-P505055?skuId=2656130&icid2=products%20grid:p505055:product#ratings-reviews-container,,Great Mascara,7 Dec 2024,Paola62090,Beautiful packaging as always when it comes to Fenty. Application was smooth and lasted a while. I think the price is a bit steep but it’s a good formula all around!
1738781940-305,https://www.sephora.com/product/fenty-hella-thicc-volumizing-mascara-P505055?skuId=2656130&icid2=products%20grid:p505055:product,1.2K,https://www.sephora.com/product/fenty-hella-thicc-volumizing-mascara-P505055?skuId=2656130&icid2=products%20grid:p505055:product#ratings-reviews-container,,Nice full lashes,6 Dec 2024,jankask20,I thought this mascara was good. I liked the shape of the wand and the mascara went on nice and smooth. It didn’t clump which is a plus. It made my lashes look full without the chunky look.
1738781940-306,https://www.sephora.com/product/fenty-hella-thicc-volumizing-mascara-P505055?skuId=2656130&icid2=products%20grid:p505055:product,1.2K,https://www.sephora.com/product/fenty-hella-thicc-volumizing-mascara-P505055?skuId=2656130&icid2=products%20grid:p505055:product#ratings-reviews-container,,,6 Dec 2024,saintxgirl,"So, just look at my pictures!! Hoping you can tell the difference between an eye and the other one, but for me it’s pretty noticeable. Looks great, lasts a lot, it has a nice applicator and doesn’t have a particular smell."
1738781940-307,https://www.sephora.com/product/fenty-hella-thicc-volumizing-mascara-P505055?skuId=2656130&icid2=products%20grid:p505055:product,1.2K,https://www.sephora.com/product/fenty-hella-thicc-volumizing-mascara-P505055?skuId=2656130&icid2=products%20grid:p505055:product#ratings-reviews-container,,Smudges,6 Dec 2024,cassideb,"I received this product for free in exchange for my honest review.

I was really excited about this one, but it just didn’t stand the test of time. 

The good:
The brush is amazing, like I’m going to steal this for future mascara applications. The formula is super light, easy to apply and very buildable. Gives great volume, definition, and stays lifted for forever. 

The bad: 
It was definitely dark and smudged under my bottom lash line by dinner time. Not black flakes, dark pigment that looks like dark circles but melted out. I have oily skin, but I figured it would have more staying power than that."
1738781940-308,https://www.sephora.com/product/fenty-hella-thicc-volumizing-mascara-P505055?skuId=2656130&icid2=products%20grid:p505055:product,1.2K,https://www.sephora.com/product/fenty-hella-thicc-volumizing-mascara-P505055?skuId=2656130&icid2=products%20grid:p505055:product#ratings-reviews-container,,Adds volume and good formula but transfers,6 Dec 2024,NatrlyKurlyKate,"I received this product for free from influenster in exchange for my honest review.  The FENTY mascara adds a lot of volume without being gloopy or wet when applying.  I enjoyed the brush it prevented the clump effect and really added volume.  I am only giving it 3 stars because although it does what it claims, it transferred to my under eye area and flaked when I tried to apply a 3rd coat.  The photo attached is after 3 coats.  I will use but not on the lower eyelids.  The bottle design is on 
point for FENTY although I wish it could stand up on its own."
1738781940-309,https://www.sephora.com/product/fenty-hella-thicc-volumizing-mascara-P505055?skuId=2656130&icid2=products%20grid:p505055:product,1.2K,https://www.sephora.com/product/fenty-hella-thicc-volumizing-mascara-P505055?skuId=2656130&icid2=products%20grid:p505055:product#ratings-reviews-container,,Definitely adds volume,6 Dec 2024,BethDarnell,I received this mascara to review. The package is cute resembling a black crystal. It does what it claims to do and adds volume to your lashes. The bristles on the applicator do a good job of grabbing the lashes on the edges I would use this one again.
1738781940-310,https://www.sephora.com/product/fenty-hella-thicc-volumizing-mascara-P505055?skuId=2656130&icid2=products%20grid:p505055:product,1.2K,https://www.sephora.com/product/fenty-hella-thicc-volumizing-mascara-P505055?skuId=2656130&icid2=products%20grid:p505055:product#ratings-reviews-container,,So good!,6 Dec 2024,brookey56,Fenty beauty by Rihanna Mascara is great! I love the shape and overall sleek look of the container. It’s easy to grip and hold. The lash brush is a standard brush so no need to adjust or get used to one of the crazy shaped ones. The product goes on rich and dark. I was able to layer and make my lashes pop. It held up well throughout a night out and work days. Overall a great mascara and one I will continue to buy!
1738781940-311,https://www.sephora.com/product/fenty-hella-thicc-volumizing-mascara-P505055?skuId=2656130&icid2=products%20grid:p505055:product,1.2K,https://www.sephora.com/product/fenty-hella-thicc-volumizing-mascara-P505055?skuId=2656130&icid2=products%20grid:p505055:product#ratings-reviews-container,,Nice mascara,6 Dec 2024,kv012,"I love this mascara! It made my lashes look great, it’s not super lengthening but it doesn’t claim to be either. It doesn’t give me raccoon eyes either"
1738781940-312,https://www.sephora.com/product/fenty-hella-thicc-volumizing-mascara-P505055?skuId=2656130&icid2=products%20grid:p505055:product,1.2K,https://www.sephora.com/product/fenty-hella-thicc-volumizing-mascara-P505055?skuId=2656130&icid2=products%20grid:p505055:product#ratings-reviews-container,,,6 Dec 2024,samsonite313,"I’m really enjoying the Fenty Beauty a Thicc Mascara. It absolutely does a great job volumizing my lashes. Lasts all day, but will smudge if you rub your eyes. Packaging is really cute, but is very lightweight and kind of cheap feeling. Overall I like it and will definitely purchase in the future. Pictured is one coat of mascara on curled lashes, no primer or liner."
