FentyMascara,,,,,,,,
web-scraper-order,web-scraper-start-url,ReviewLink,ReviewLink-href,Pagination,Title,Date,UserID,ReviewText
1738781940-1,https://www.sephora.com/product/fenty-hella-thicc-volumizing-mascara-P505055?skuId=2656130&icid2=products%20grid:p505055:product,1.2K,https://www.sephora.com/product/fenty-hella-thicc-volumizing-mascara-P505055?skuId=2656130&icid2=products%20grid:p505055:product#ratings-reviews-container,,my new obsession,6 d ago,Melissstark,"i rarely write beauty reviews, because sadly i’m rarely impressed. 
so so so impressed. by far the best mascara i’ve ever used!!"
1738781940-2,https://www.sephora.com/product/fenty-hella-thicc-volumizing-mascara-P505055?skuId=2656130&icid2=products%20grid:p505055:product,1.2K,https://www.sephora.com/product/fenty-hella-thicc-volumizing-mascara-P505055?skuId=2656130&icid2=products%20grid:p505055:product#ratings-reviews-container,,4 of 5,7 d ago,lilycavv,"I was super excited to try this product. First application, I loved the wand to apply the product. It didn’t win me over first try, I didn’t like the way my eyelashes looked at first. Then as I continued to apply it after a few days I did seek to like it more and more. It made my eyelashes look full. One thing to note, this mascara is NOT waterproof."
1738781940-3,https://www.sephora.com/product/fenty-hella-thicc-volumizing-mascara-P505055?skuId=2656130&icid2=products%20grid:p505055:product,1.2K,https://www.sephora.com/product/fenty-hella-thicc-volumizing-mascara-P505055?skuId=2656130&icid2=products%20grid:p505055:product#ratings-reviews-container,,love it,7 d ago,lianamarie1,"I love it, made my lashes look like falsies. Only thing is, it does hold my lashes up but only after I went back in with my lash curler. When its first applied it will weigh your lashes down and you will have to go in and curl them again, if you're looking for something that will hold without having to go back in with your lash curler I don't suggest this for you, but i think it's a good product."
1738781940-4,https://www.sephora.com/product/fenty-hella-thicc-volumizing-mascara-P505055?skuId=2656130&icid2=products%20grid:p505055:product,1.2K,https://www.sephora.com/product/fenty-hella-thicc-volumizing-mascara-P505055?skuId=2656130&icid2=products%20grid:p505055:product#ratings-reviews-container,,Super nice mascara,7 d ago,burningisis,I really like using this mascara it doesn’t flake off and it gives a good natural thickness. I have used this on both lashes and natural lashes and it is good on both.
1738781940-5,https://www.sephora.com/product/fenty-hella-thicc-volumizing-mascara-P505055?skuId=2656130&icid2=products%20grid:p505055:product,1.2K,https://www.sephora.com/product/fenty-hella-thicc-volumizing-mascara-P505055?skuId=2656130&icid2=products%20grid:p505055:product#ratings-reviews-container,,Must have!,7 d ago,BrightonSkye,"Makes my lashes fuller, longer, more voluminous. Easy to apply, the wand is fantastic. No gross clumps! My only issue is as a person with light colored eyes I squint and blink a lot and need waterproof to avoid raccoon eyes."
1738781940-6,https://www.sephora.com/product/fenty-hella-thicc-volumizing-mascara-P505055?skuId=2656130&icid2=products%20grid:p505055:product,1.2K,https://www.sephora.com/product/fenty-hella-thicc-volumizing-mascara-P505055?skuId=2656130&icid2=products%20grid:p505055:product#ratings-reviews-container,,Great mascara,8 d ago,BLynee,"Love this mascara it’s got volume, proper thickness, and color also lasts all day and washes off gently. The one thing about it to love is the super softness!"
1738781940-7,https://www.sephora.com/product/fenty-hella-thicc-volumizing-mascara-P505055?skuId=2656130&icid2=products%20grid:p505055:product,1.2K,https://www.sephora.com/product/fenty-hella-thicc-volumizing-mascara-P505055?skuId=2656130&icid2=products%20grid:p505055:product#ratings-reviews-container,,Great for straight lashes,9 d ago,alambchop,"Great for straight lashes hesitant to curl. I normally have to get waterproof otherwise wetter formulas weight down my lashes, but I like this formula and it’s easy to take off at the end of the day."
1738781940-8,https://www.sephora.com/product/fenty-hella-thicc-volumizing-mascara-P505055?skuId=2656130&icid2=products%20grid:p505055:product,1.2K,https://www.sephora.com/product/fenty-hella-thicc-volumizing-mascara-P505055?skuId=2656130&icid2=products%20grid:p505055:product#ratings-reviews-container,,,12 d ago,robweezy,I only gave 4 stars because it tends to transfer after application. It has amazing length and volume I was very impressed with the way it separated each lash and it looked beautiful
1738781940-9,https://www.sephora.com/product/fenty-hella-thicc-volumizing-mascara-P505055?skuId=2656130&icid2=products%20grid:p505055:product,1.2K,https://www.sephora.com/product/fenty-hella-thicc-volumizing-mascara-P505055?skuId=2656130&icid2=products%20grid:p505055:product#ratings-reviews-container,,Little heavy but good,12 d ago,Sassyitgirl,I have long lashes but they are very thin. So any mascara that is heavy makes me look like a raccoon very quickly.  This mascara is a bit on the heavier side but didn’t cause the issue.  I would use it again. I’m a big fan of Rihanna’s product line.
1738781940-10,https://www.sephora.com/product/fenty-hella-thicc-volumizing-mascara-P505055?skuId=2656130&icid2=products%20grid:p505055:product,1.2K,https://www.sephora.com/product/fenty-hella-thicc-volumizing-mascara-P505055?skuId=2656130&icid2=products%20grid:p505055:product#ratings-reviews-container,,,12 d ago,loreleikitiara,This mascara was good it is super black and makes your eyelashes look really long and full the only problem I had with it was it smudging if I put it on my lower lash line so I just put it on the upper lash line
1738781940-11,https://www.sephora.com/product/fenty-hella-thicc-volumizing-mascara-P505055?skuId=2656130&icid2=products%20grid:p505055:product,1.2K,https://www.sephora.com/product/fenty-hella-thicc-volumizing-mascara-P505055?skuId=2656130&icid2=products%20grid:p505055:product#ratings-reviews-container,,,12 d ago,BreonnaM,"PERFECTTTTT, gives lashes the best volume that no mascot could ever give. Not runny at all either"
1738781940-12,https://www.sephora.com/product/fenty-hella-thicc-volumizing-mascara-P505055?skuId=2656130&icid2=products%20grid:p505055:product,1.2K,https://www.sephora.com/product/fenty-hella-thicc-volumizing-mascara-P505055?skuId=2656130&icid2=products%20grid:p505055:product#ratings-reviews-container,,Does the job very well!,14 d ago,SCLuv,Lengthens and thickens.  I’d buy it again. Doesn’t clump but you need a good remover to get rid of it.
1738781940-13,https://www.sephora.com/product/fenty-hella-thicc-volumizing-mascara-P505055?skuId=2656130&icid2=products%20grid:p505055:product,1.2K,https://www.sephora.com/product/fenty-hella-thicc-volumizing-mascara-P505055?skuId=2656130&icid2=products%20grid:p505055:product#ratings-reviews-container,,Hella thicc,14 d ago,StefsOpinion,"Cute and simple packaging. Priced well for a known brand, won't break the bank. Works pretty well, thickens and lengthens lashes nicely. Can be a little clumpy when applying, but if you have a spare clean brush, you can smooth the clumps out. Worth buying if you want hella thic lashes."
1738781940-14,https://www.sephora.com/product/fenty-hella-thicc-volumizing-mascara-P505055?skuId=2656130&icid2=products%20grid:p505055:product,1.2K,https://www.sephora.com/product/fenty-hella-thicc-volumizing-mascara-P505055?skuId=2656130&icid2=products%20grid:p505055:product#ratings-reviews-container,,,14 d ago,itsmetima,It does the job and is a decent mascara. The better than sex by too faced I find is less dense and tends to keep the lashes curled higher for longer than this one.
1738781940-15,https://www.sephora.com/product/fenty-hella-thicc-volumizing-mascara-P505055?skuId=2656130&icid2=products%20grid:p505055:product,1.2K,https://www.sephora.com/product/fenty-hella-thicc-volumizing-mascara-P505055?skuId=2656130&icid2=products%20grid:p505055:product#ratings-reviews-container,,best mascara,14 d ago,eastbrunswick,best lash product I have ever used and love my lashes.
1738781940-16,https://www.sephora.com/product/fenty-hella-thicc-volumizing-mascara-P505055?skuId=2656130&icid2=products%20grid:p505055:product,1.2K,https://www.sephora.com/product/fenty-hella-thicc-volumizing-mascara-P505055?skuId=2656130&icid2=products%20grid:p505055:product#ratings-reviews-container,,,15 d ago,lypham,"Like the size of the brush. Easily coated my lashes in a few swipes without getting all over my eyelids. The formula is very lengthening and volumizing. However, it did bleed on me towards the end of the day."
1738781940-17,https://www.sephora.com/product/fenty-hella-thicc-volumizing-mascara-P505055?skuId=2656130&icid2=products%20grid:p505055:product,1.2K,https://www.sephora.com/product/fenty-hella-thicc-volumizing-mascara-P505055?skuId=2656130&icid2=products%20grid:p505055:product#ratings-reviews-container,,,15 d ago,cassietayler,"This is one of my new mascaras! I had been on the hunt for a new one and am a fan of this brand so I was very excited to try it out! 
It is very pigmented so I try and apply light layers!"
1738781940-18,https://www.sephora.com/product/fenty-hella-thicc-volumizing-mascara-P505055?skuId=2656130&icid2=products%20grid:p505055:product,1.2K,https://www.sephora.com/product/fenty-hella-thicc-volumizing-mascara-P505055?skuId=2656130&icid2=products%20grid:p505055:product#ratings-reviews-container,,definitely worth buying,16 d ago,itsmelsephora,I got this mascara to try it out and its the best one i own so far it has a lot of product. definitely recommend getting for a gift or for your own. Love itt!
1738781940-19,https://www.sephora.com/product/fenty-hella-thicc-volumizing-mascara-P505055?skuId=2656130&icid2=products%20grid:p505055:product,1.2K,https://www.sephora.com/product/fenty-hella-thicc-volumizing-mascara-P505055?skuId=2656130&icid2=products%20grid:p505055:product#ratings-reviews-container,,Beautiful mascara,18 d ago,jazzrae23,"I love this mascara it makes my lashes long and really thick without clumping together. My lashes look long and healthy,It’s easy to use and doesn’t get everywhere like a lot of other mascaras. Doesn’t have a smell that’s awful or strong and It last all day without flaking. The packaging is useful as it’s a flat surface rather than round and it’s easier to store. This will be my go to for now on."
1738781940-20,https://www.sephora.com/product/fenty-hella-thicc-volumizing-mascara-P505055?skuId=2656130&icid2=products%20grid:p505055:product,1.2K,https://www.sephora.com/product/fenty-hella-thicc-volumizing-mascara-P505055?skuId=2656130&icid2=products%20grid:p505055:product#ratings-reviews-container,,Must have,18 d ago,KW04683,"I love how smooth this goes on. Looks great, easy to hold, and maneuver. Really makes your lashes pop. The packaging is eye-catching. I would recommend this product ."
1738781940-21,https://www.sephora.com/product/fenty-hella-thicc-volumizing-mascara-P505055?skuId=2656130&icid2=products%20grid:p505055:product,1.2K,https://www.sephora.com/product/fenty-hella-thicc-volumizing-mascara-P505055?skuId=2656130&icid2=products%20grid:p505055:product#ratings-reviews-container,,Amazing!,19 d ago,Val3231,I received this product from Influenster in exchange for my honest review. This is the first product that I have ever tried from Fenty. As someone who has very straight lashes it is so hard to find a good mascara. This works super well with my lashes I usually curl them with my shiseido eyelash curler then go in with the first coat let it dry curl again and so on with a second coat and omg it does wonders. It makes my eyelashes super nice and voluminous. I love that you can add several coats and it does no clump. This product definitely makes me want to try out more fenty products! So far I am impressed and this is only one product from the line. Can’t wait to try more!
1738781940-22,https://www.sephora.com/product/fenty-hella-thicc-volumizing-mascara-P505055?skuId=2656130&icid2=products%20grid:p505055:product,1.2K,https://www.sephora.com/product/fenty-hella-thicc-volumizing-mascara-P505055?skuId=2656130&icid2=products%20grid:p505055:product#ratings-reviews-container,,Not my favorite,19 d ago,Aubz91,I do like the formula of this mascara but it’s definitely not my favorite by far.  For the price point I expected much more.  I feel like the brush was too big for me and also it smudged quickly.  That being said it did enhance my lash length and volume.
1738781940-23,https://www.sephora.com/product/fenty-hella-thicc-volumizing-mascara-P505055?skuId=2656130&icid2=products%20grid:p505055:product,1.2K,https://www.sephora.com/product/fenty-hella-thicc-volumizing-mascara-P505055?skuId=2656130&icid2=products%20grid:p505055:product#ratings-reviews-container,,Not my favorite mascara,19 d ago,JulyPI,"This’s quite a decent mascara, it definitely gives volume and length, I usually curl my eyelashes before and it didn’t weigh them down. It feels on a drier side for me, and I had some fall outs. I used to have Fenty FULL FRONTAL VOLUME, LIFT & CURL MASCARA, and this one I really loved. It was perfect for me, especially how it curled up my lashes.
The Hella Thick isn’t impressive for me, I wouldn’t buy it for myself."
1738781940-24,https://www.sephora.com/product/fenty-hella-thicc-volumizing-mascara-P505055?skuId=2656130&icid2=products%20grid:p505055:product,1.2K,https://www.sephora.com/product/fenty-hella-thicc-volumizing-mascara-P505055?skuId=2656130&icid2=products%20grid:p505055:product#ratings-reviews-container,,Good but smears if wearing all night,22 d ago,Snemery,"I’ve wanted to try the Fenty brand for awhile so I was really excited about this mascara. Putting it on was nice, smooth not clumpy. Length added was pretty good. I took a picture with one eye done and one not for comparison. It lasted all day and didn’t flake. Only down fall, I don’t always wash my make up off at night, and this mascara smears pretty bad! Not the worst I’ve used, but definitely worst than my regular go-to mascara. I had to use a makeup wipe first thing in the morning where I normally wait and wash my face after coffee. It was also on my pillowcase, which again, isn’t normal for me. If you wash before bed, no problem and good go to!"
1738781940-25,https://www.sephora.com/product/fenty-hella-thicc-volumizing-mascara-P505055?skuId=2656130&icid2=products%20grid:p505055:product,1.2K,https://www.sephora.com/product/fenty-hella-thicc-volumizing-mascara-P505055?skuId=2656130&icid2=products%20grid:p505055:product#ratings-reviews-container,,Worst mascara,23 d ago,Sofi567,"When I came to the shop , the helper convinced me that I wouldn’t look like a panda after using it , but I did  so totally not recommending"
1738781940-26,https://www.sephora.com/product/fenty-hella-thicc-volumizing-mascara-P505055?skuId=2656130&icid2=products%20grid:p505055:product,1.2K,https://www.sephora.com/product/fenty-hella-thicc-volumizing-mascara-P505055?skuId=2656130&icid2=products%20grid:p505055:product#ratings-reviews-container,,Gives volume.,23 d ago,,Brush is thick and fluffy gives volume and length.
1738781940-27,https://www.sephora.com/product/fenty-hella-thicc-volumizing-mascara-P505055?skuId=2656130&icid2=products%20grid:p505055:product,1.2K,https://www.sephora.com/product/fenty-hella-thicc-volumizing-mascara-P505055?skuId=2656130&icid2=products%20grid:p505055:product#ratings-reviews-container,,,23 d ago,knk0311,This mascara really breathes life into my eyelashes! They’re so long and thick. They’re gorgeous. I love the applicator and the packaging is super cute. I would definitely buy more of this. I received this for free from Influenster and the opinions are my own.
1738781940-28,https://www.sephora.com/product/fenty-hella-thicc-volumizing-mascara-P505055?skuId=2656130&icid2=products%20grid:p505055:product,1.2K,https://www.sephora.com/product/fenty-hella-thicc-volumizing-mascara-P505055?skuId=2656130&icid2=products%20grid:p505055:product#ratings-reviews-container,,A fantastic mascara!,25 d ago,AnnHannah,"Fantastic mascara, from someone who is very picky! I seldom find mascaras that I feel work with my eyelashes and don’t get clumpy or look like spider legs. I like a thin but elongating coat and this is perfect for that! I prefer a different applicator usually but this works very well!"
1738781940-29,https://www.sephora.com/product/fenty-hella-thicc-volumizing-mascara-P505055?skuId=2656130&icid2=products%20grid:p505055:product,1.2K,https://www.sephora.com/product/fenty-hella-thicc-volumizing-mascara-P505055?skuId=2656130&icid2=products%20grid:p505055:product#ratings-reviews-container,,Fab Fenty,25 d ago,egonza78,"This is probably the best mascara I’ve ever had. It adds volume, thickens, and makes my lashes longer. Loved the black tint and easy application. Packaging was clean and easy to read. I love it!! Definitely worth the price and a great product. I would recommend it."
1738781940-30,https://www.sephora.com/product/fenty-hella-thicc-volumizing-mascara-P505055?skuId=2656130&icid2=products%20grid:p505055:product,1.2K,https://www.sephora.com/product/fenty-hella-thicc-volumizing-mascara-P505055?skuId=2656130&icid2=products%20grid:p505055:product#ratings-reviews-container,,Great mascara!,25 d ago,vmnguyen07,Mascara glided on effortlessly. Was able to apply layers without it looking clumpy or flakey. It didn’t smear when I wore it all day for work. Packaging makes it look fancy for the price. Would recommend this product to try!
1738781940-31,https://www.sephora.com/product/fenty-hella-thicc-volumizing-mascara-P505055?skuId=2656130&icid2=products%20grid:p505055:product,1.2K,https://www.sephora.com/product/fenty-hella-thicc-volumizing-mascara-P505055?skuId=2656130&icid2=products%20grid:p505055:product#ratings-reviews-container,,The best ever,25 d ago,Aaliyaharriott,This mascara is so good! It left my lashes looking full and the volume is crazy! Absolutely understand the hype. The formula is a perfect combination of not being to dry or wet which is typically what I go for in mascaras!
1738781940-32,https://www.sephora.com/product/fenty-hella-thicc-volumizing-mascara-P505055?skuId=2656130&icid2=products%20grid:p505055:product,1.2K,https://www.sephora.com/product/fenty-hella-thicc-volumizing-mascara-P505055?skuId=2656130&icid2=products%20grid:p505055:product#ratings-reviews-container,,Natural looking hella- thic lashes,26 d ago,Dkkk,"The best mascara hands down!! After using all kinds of mascara , i can tell this is the best i came up with , for those girlies who dnt have longer lashes.."
1738781940-33,https://www.sephora.com/product/fenty-hella-thicc-volumizing-mascara-P505055?skuId=2656130&icid2=products%20grid:p505055:product,1.2K,https://www.sephora.com/product/fenty-hella-thicc-volumizing-mascara-P505055?skuId=2656130&icid2=products%20grid:p505055:product#ratings-reviews-container,,Volume & thickness for hours,26 d ago,lovue,"I am in love! From the packaging to the product,  everything is so well thought out. It has the applicator wand has the bristles in all the correct places to give you lashes with volume. I have very things flat lashes, and this has completely changed the eyelash game for me. Usually, I will have watery eyes with some eye lash products, but with this one, I don't have to worry about that at all. Highly recommend 10/10 I received this a a review"
1738781940-34,https://www.sephora.com/product/fenty-hella-thicc-volumizing-mascara-P505055?skuId=2656130&icid2=products%20grid:p505055:product,1.2K,https://www.sephora.com/product/fenty-hella-thicc-volumizing-mascara-P505055?skuId=2656130&icid2=products%20grid:p505055:product#ratings-reviews-container,,Great product,26 d ago,TracyEmily1o1,I received this product for free and I am an absolute love it stays on so well throughout the day and applies very easy and is a great value
1738781940-35,https://www.sephora.com/product/fenty-hella-thicc-volumizing-mascara-P505055?skuId=2656130&icid2=products%20grid:p505055:product,1.2K,https://www.sephora.com/product/fenty-hella-thicc-volumizing-mascara-P505055?skuId=2656130&icid2=products%20grid:p505055:product#ratings-reviews-container,,Love the Lashes!!,26 d ago,SNH31,"I love the bold, black shade of this mascara! I also really like the shape of this wand. It's easy-to-apply to lashes, with minimal tugging and pulling. Clumping was minimal, but I did comb through my lashes with a separator, after applying several coats of this mascara. Overall, I do recommend Fenty's Hella Thicc Mascara, and I will continue to use it!!"
1738781940-36,https://www.sephora.com/product/fenty-hella-thicc-volumizing-mascara-P505055?skuId=2656130&icid2=products%20grid:p505055:product,1.2K,https://www.sephora.com/product/fenty-hella-thicc-volumizing-mascara-P505055?skuId=2656130&icid2=products%20grid:p505055:product#ratings-reviews-container,,Pretty good,27 d ago,FosterMom1,"The Hella Thic Volumizing Mascara is an 8/10. It loses points because I don’t feel as though it thickened my lashes at all. It lengthened and curled, but there were a good bit of flakes on my face by 10am."
1738781940-37,https://www.sephora.com/product/fenty-hella-thicc-volumizing-mascara-P505055?skuId=2656130&icid2=products%20grid:p505055:product,1.2K,https://www.sephora.com/product/fenty-hella-thicc-volumizing-mascara-P505055?skuId=2656130&icid2=products%20grid:p505055:product#ratings-reviews-container,,Love,27 d ago,BoyMomx84,"Fenty Beauty Hella Thicc Volumizing Mascara is a top-notch product that delivers a transformation. The applicator makes it easy to apply and reach all lashes giving a fuller look. I prefer a black shade mascara and love the deep rich black that it provides. This mascara is waterproof and doesn’t flake or smudge. I highly recommend the Fenty Beauty Hella Thicc Volumizing Mascara to anyone looking for a reliable, volumizing, lengthening mascara that will stay put!"
1738781940-38,https://www.sephora.com/product/fenty-hella-thicc-volumizing-mascara-P505055?skuId=2656130&icid2=products%20grid:p505055:product,1.2K,https://www.sephora.com/product/fenty-hella-thicc-volumizing-mascara-P505055?skuId=2656130&icid2=products%20grid:p505055:product#ratings-reviews-container,,I absolutely love this mascara!😍,27 d ago,luckygirlmalone,"I absolutely love this mascara! Great for long lashes, especially when you use a curler. Packaging feels luxurious. Very easy to remove at the end of wearing.😍"
1738781940-39,https://www.sephora.com/product/fenty-hella-thicc-volumizing-mascara-P505055?skuId=2656130&icid2=products%20grid:p505055:product,1.2K,https://www.sephora.com/product/fenty-hella-thicc-volumizing-mascara-P505055?skuId=2656130&icid2=products%20grid:p505055:product#ratings-reviews-container,,Love it,27 d ago,JennaLady,"Fenty beauty has come with some beautiful products, and this adds to the collection. Hella thic mascara is black. Definitely gives you a curl and lengthen them.It smells like glue to me but doesn't have a scent. This is reasonable priced and I will buy it again."
1738781940-40,https://www.sephora.com/product/fenty-hella-thicc-volumizing-mascara-P505055?skuId=2656130&icid2=products%20grid:p505055:product,1.2K,https://www.sephora.com/product/fenty-hella-thicc-volumizing-mascara-P505055?skuId=2656130&icid2=products%20grid:p505055:product#ratings-reviews-container,,Gives volume but smudges,28 d ago,MoonPetal21,"This mascara was able to give my pin straight Asian lashes some volume and was able to retain the curl. I was only able to use 1 coat before it became too clumpy. This mascara does transfer to your upper lids and does not dry down very quickly. For those of you that prefer a dryer mascara, this is not for you. It is a very wet formula. It does tend to smudge throughout the day/night and is not long wearing. But, it does remove easily with little effort. I was given this product free for testing and review."
1738781940-41,https://www.sephora.com/product/fenty-hella-thicc-volumizing-mascara-P505055?skuId=2656130&icid2=products%20grid:p505055:product,1.2K,https://www.sephora.com/product/fenty-hella-thicc-volumizing-mascara-P505055?skuId=2656130&icid2=products%20grid:p505055:product#ratings-reviews-container,,Nice shade of black,28 d ago,greeneyes1988,I received the fenty beauty by Rihanna fenty hella thicc mascara and it did not disappoint. I love a dark black mascara. It applied well and is a great deal. I would recommend!
1738781940-42,https://www.sephora.com/product/fenty-hella-thicc-volumizing-mascara-P505055?skuId=2656130&icid2=products%20grid:p505055:product,1.2K,https://www.sephora.com/product/fenty-hella-thicc-volumizing-mascara-P505055?skuId=2656130&icid2=products%20grid:p505055:product#ratings-reviews-container,,Easy application,28 d ago,5NaturalBeauty,This Fenty Hella Thick Mascara is easy to apply and goes on evenly due to the applicator. It has become my favorite mascara because you can add multiple layers without it clumping. I use it in my natural lashes so I use two applications. When I wear it in falsies I only use one layer. The price is comparable to other designer mascaras and provide better benefits. I recommend others to try.
1738781940-43,https://www.sephora.com/product/fenty-hella-thicc-volumizing-mascara-P505055?skuId=2656130&icid2=products%20grid:p505055:product,1.2K,https://www.sephora.com/product/fenty-hella-thicc-volumizing-mascara-P505055?skuId=2656130&icid2=products%20grid:p505055:product#ratings-reviews-container,,Great mascara,28 d ago,124makeuplover,I love this mascara. It was very great. There was no cent. It’s a little expensive but the application goes on smooth not clumpy and overall pretty good.
