FentyMascara,,,,,,,,
1738781940-925,https://www.sephora.com/product/fenty-hella-thicc-volumizing-mascara-P505055?skuId=2656130&icid2=products%20grid:p505055:product,1.2K,https://www.sephora.com/product/fenty-hella-thicc-volumizing-mascara-P505055?skuId=2656130&icid2=products%20grid:p505055:product#ratings-reviews-container,,perfect for the short lash girlys,9 Aug 2023,Amelialmostpond,love it. perfect for the short lash girly.   I hope they add a brown version of this mascara. 10 out of 10 would definitely recommend
1738781940-926,https://www.sephora.com/product/fenty-hella-thicc-volumizing-mascara-P505055?skuId=2656130&icid2=products%20grid:p505055:product,1.2K,https://www.sephora.com/product/fenty-hella-thicc-volumizing-mascara-P505055?skuId=2656130&icid2=products%20grid:p505055:product#ratings-reviews-container,,Worth another shot!,9 Aug 2023,PrettyGirlT205,"I love most fenty products, but this isn't my favorite. It is fairly clumpy. After 1 layer it gets clumpy and I am not a fan of that. The wand is wonderfully made, however the formula needs a little more improvement. If that was fixed I would definitely buy again."
1738781940-927,https://www.sephora.com/product/fenty-hella-thicc-volumizing-mascara-P505055?skuId=2656130&icid2=products%20grid:p505055:product,1.2K,https://www.sephora.com/product/fenty-hella-thicc-volumizing-mascara-P505055?skuId=2656130&icid2=products%20grid:p505055:product#ratings-reviews-container,,A must -have for me,9 Aug 2023,Janejoey,"This mascara truly adds volume and length to lashes without clumping or smudging. It came with an applicator which makes it a lot easier to  coat your lash lines.
The wear time is excellent ( I wore it for 12hours and it didn’t smear).

Another thing I love about this mascara is how dark it is, it gave me a  striking bold look which is very unusual with some mascaras I have tried.(like I wore false lashes.)
All in all , this product is amazing and I will rate it⭐️⭐️⭐️⭐️⭐️."
1738781940-928,https://www.sephora.com/product/fenty-hella-thicc-volumizing-mascara-P505055?skuId=2656130&icid2=products%20grid:p505055:product,1.2K,https://www.sephora.com/product/fenty-hella-thicc-volumizing-mascara-P505055?skuId=2656130&icid2=products%20grid:p505055:product#ratings-reviews-container,,,9 Aug 2023,xoec,I love the volume of this mascara and appreciate that there aren’t any clumps.
1738781940-929,https://www.sephora.com/product/fenty-hella-thicc-volumizing-mascara-P505055?skuId=2656130&icid2=products%20grid:p505055:product,1.2K,https://www.sephora.com/product/fenty-hella-thicc-volumizing-mascara-P505055?skuId=2656130&icid2=products%20grid:p505055:product#ratings-reviews-container,,A little sweat and your done for,9 Aug 2023,ReddestWine,"It’s not water proof and in this heat where I live the sweat didn’t help this mascara, it ran under my eyes like it was getting robbed. My lashes are already long so all it did was just make them dark. At first the Mascra made them pretty and I liked it . But with time they looked horrible. I only use water proof mascara because of the climate I'm in. A good mascara which is true and true is the Lancôme one. Unfortunately I can't switch up my main for this."
1738781940-930,https://www.sephora.com/product/fenty-hella-thicc-volumizing-mascara-P505055?skuId=2656130&icid2=products%20grid:p505055:product,1.2K,https://www.sephora.com/product/fenty-hella-thicc-volumizing-mascara-P505055?skuId=2656130&icid2=products%20grid:p505055:product#ratings-reviews-container,,Perfect for those lashes we crave,9 Aug 2023,gudgurldone,"Hella impressed with Hella Thicc Volumizing Mascara by Fenty Beauty. To me, it starts with the applicator tip, and Hella Thicc has the perfect tip for holding and applying the mascara to each and every lash - flawlessly. Rich, smooth mascara is fantastic. This product is perfect for those big, thicc, long lashes we crave."
1738781940-931,https://www.sephora.com/product/fenty-hella-thicc-volumizing-mascara-P505055?skuId=2656130&icid2=products%20grid:p505055:product,1.2K,https://www.sephora.com/product/fenty-hella-thicc-volumizing-mascara-P505055?skuId=2656130&icid2=products%20grid:p505055:product#ratings-reviews-container,,"Bolder, Thiccer Lashes",9 Aug 2023,themirandak,"I've tried just about every volumizing mascara on the market, and Hella Thicc lives up to its name! My lashes aren't super long, but this mascara makes them thicker and bolder. I would buy, use and recommend Hella Thicc, especially for more dramatic, night looks."
1738781940-932,https://www.sephora.com/product/fenty-hella-thicc-volumizing-mascara-P505055?skuId=2656130&icid2=products%20grid:p505055:product,1.2K,https://www.sephora.com/product/fenty-hella-thicc-volumizing-mascara-P505055?skuId=2656130&icid2=products%20grid:p505055:product#ratings-reviews-container,,Good for beginners,9 Aug 2023,MegumiK,I'm not a big mascara user since I don't like the feeling of stuff on my lashes but this one was pretty good! Application was easy and it didn't clump. My only issue is slight smudging but I might have over applied it.
1738781940-933,https://www.sephora.com/product/fenty-hella-thicc-volumizing-mascara-P505055?skuId=2656130&icid2=products%20grid:p505055:product,1.2K,https://www.sephora.com/product/fenty-hella-thicc-volumizing-mascara-P505055?skuId=2656130&icid2=products%20grid:p505055:product#ratings-reviews-container,,New mascara staple,9 Aug 2023,Helenc5,Absolutely love this Fenty Mascara. It creates a ton of volume while still looking seamless. I personally use an eyelash primer with it so it goes on so smoothly doesn't clump at all and lasts all day.
1738781940-934,https://www.sephora.com/product/fenty-hella-thicc-volumizing-mascara-P505055?skuId=2656130&icid2=products%20grid:p505055:product,1.2K,https://www.sephora.com/product/fenty-hella-thicc-volumizing-mascara-P505055?skuId=2656130&icid2=products%20grid:p505055:product#ratings-reviews-container,,Must Have !!!!,9 Aug 2023,makeuplover3097,I have been using this mascara for the past 3 days now and I absolutely love it . I love how it give my tiny lashes length . I would definitely recommend this to others !
1738781940-935,https://www.sephora.com/product/fenty-hella-thicc-volumizing-mascara-P505055?skuId=2656130&icid2=products%20grid:p505055:product,1.2K,https://www.sephora.com/product/fenty-hella-thicc-volumizing-mascara-P505055?skuId=2656130&icid2=products%20grid:p505055:product#ratings-reviews-container,,,9 Aug 2023,NaniTX,"Love how light this mascara is. It does not weigh down your lashes. Although it is volumizing, it does not hold the curl as well as I would like."
1738781940-936,https://www.sephora.com/product/fenty-hella-thicc-volumizing-mascara-P505055?skuId=2656130&icid2=products%20grid:p505055:product,1.2K,https://www.sephora.com/product/fenty-hella-thicc-volumizing-mascara-P505055?skuId=2656130&icid2=products%20grid:p505055:product#ratings-reviews-container,,Recommend,9 Aug 2023,Sass120,It smudges a lot but that doesn’t affect the performance aid the mascara. It fills out my lashes since they are so thin . It’s a great buy.
1738781940-937,https://www.sephora.com/product/fenty-hella-thicc-volumizing-mascara-P505055?skuId=2656130&icid2=products%20grid:p505055:product,1.2K,https://www.sephora.com/product/fenty-hella-thicc-volumizing-mascara-P505055?skuId=2656130&icid2=products%20grid:p505055:product#ratings-reviews-container,,Buy it Sis!,9 Aug 2023,vwalker23,This mascara is everything you need and more when it comes to lightweight. It gives your lashes the length you want without looking clumpy.
1738781940-938,https://www.sephora.com/product/fenty-hella-thicc-volumizing-mascara-P505055?skuId=2656130&icid2=products%20grid:p505055:product,1.2K,https://www.sephora.com/product/fenty-hella-thicc-volumizing-mascara-P505055?skuId=2656130&icid2=products%20grid:p505055:product#ratings-reviews-container,,FENTY BEAUTY BY RIHANNA,9 Aug 2023,Kenny1403,I really love this mascara because it makes my lashes look good since I don’t have a lot of lashes it makes it look like I have long lashes. I don’t know if I see a curl effect or not I’ll have to continue to use it to see if it does.
1738781940-939,https://www.sephora.com/product/fenty-hella-thicc-volumizing-mascara-P505055?skuId=2656130&icid2=products%20grid:p505055:product,1.2K,https://www.sephora.com/product/fenty-hella-thicc-volumizing-mascara-P505055?skuId=2656130&icid2=products%20grid:p505055:product#ratings-reviews-container,,Another Great Fenty Product!,8 Aug 2023,Fuego56743267,"Note: I received this item complimentary in exchange for my review. However, this review reflects my true opinion.

I currently have several Fenty items that I love and use as apart of my go to makeup routine, so I was very excited to try the new Fenty Hella Thicc Mascara! This mascara gave my lashes volume and length without being clumpy or heavy. The effect of the mascara was very natural looking and definitely gave my eyes a little bit of pop.

For application, I brushed my lashes with a clean spoolie, applied 1 coat of mascara, and then brushed through again with a clean spoolie. 

Other reviewers noted that the mascara flaked/smudged. I didn’t experience any flaking or smudging, but I only used a light coat and was not sweating or anything like that. 

Overall, would recommend!"
1738781940-940,https://www.sephora.com/product/fenty-hella-thicc-volumizing-mascara-P505055?skuId=2656130&icid2=products%20grid:p505055:product,1.2K,https://www.sephora.com/product/fenty-hella-thicc-volumizing-mascara-P505055?skuId=2656130&icid2=products%20grid:p505055:product#ratings-reviews-container,,This is a must have for everyone’s makeup!,8 Aug 2023,dinesty,"The pass few weeks trying this new product have turned out better then I expected, this fenty beauty mascara is the best mascara that I have ever tried. And yes, she is hella thick!"
1738781940-941,https://www.sephora.com/product/fenty-hella-thicc-volumizing-mascara-P505055?skuId=2656130&icid2=products%20grid:p505055:product,1.2K,https://www.sephora.com/product/fenty-hella-thicc-volumizing-mascara-P505055?skuId=2656130&icid2=products%20grid:p505055:product#ratings-reviews-container,,,6 Aug 2023,HausMaus94,"Smudges like crazy. It gives really nice volume and coverage, but not worth it since it smudges."
1738781940-942,https://www.sephora.com/product/fenty-hella-thicc-volumizing-mascara-P505055?skuId=2656130&icid2=products%20grid:p505055:product,1.2K,https://www.sephora.com/product/fenty-hella-thicc-volumizing-mascara-P505055?skuId=2656130&icid2=products%20grid:p505055:product#ratings-reviews-container,,Yesss,6 Aug 2023,Katiedawn123,Absolutely gorgeous mascara! Can’t recommend it enough! If you want full thick lashes look no further
1738781940-943,https://www.sephora.com/product/fenty-hella-thicc-volumizing-mascara-P505055?skuId=2656130&icid2=products%20grid:p505055:product,1.2K,https://www.sephora.com/product/fenty-hella-thicc-volumizing-mascara-P505055?skuId=2656130&icid2=products%20grid:p505055:product#ratings-reviews-container,,A must have,5 Aug 2023,curlyqbri,"I love fenty beauty! I was ecstatic to be gifted this Hella thicc volumizing mascara from Fenty beauty. It’s super black which I love and it makes my lashes look long, thick, & voluminous."
1738781940-944,https://www.sephora.com/product/fenty-hella-thicc-volumizing-mascara-P505055?skuId=2656130&icid2=products%20grid:p505055:product,1.2K,https://www.sephora.com/product/fenty-hella-thicc-volumizing-mascara-P505055?skuId=2656130&icid2=products%20grid:p505055:product#ratings-reviews-container,,Get this!,5 Aug 2023,jjjjjjjjjjjjjjh,Just got this product today. The packaging is beautiful. Very sleek and professional looking. Really added volume to my lashes!
1738781940-945,https://www.sephora.com/product/fenty-hella-thicc-volumizing-mascara-P505055?skuId=2656130&icid2=products%20grid:p505055:product,1.2K,https://www.sephora.com/product/fenty-hella-thicc-volumizing-mascara-P505055?skuId=2656130&icid2=products%20grid:p505055:product#ratings-reviews-container,,Smudges everywhere,3 Aug 2023,RacqtheBelle,"This mascara smudges under my eyes and leaves dark circles no matter the weather. It does make my lashes look thicker, but the way it smudges, it makes me look exhausted. Not worth the money at all."
1738781940-946,https://www.sephora.com/product/fenty-hella-thicc-volumizing-mascara-P505055?skuId=2656130&icid2=products%20grid:p505055:product,1.2K,https://www.sephora.com/product/fenty-hella-thicc-volumizing-mascara-P505055?skuId=2656130&icid2=products%20grid:p505055:product#ratings-reviews-container,,Meh,30 Jul 2023,3343,This mascara makes my lashes look full . However it is impossible to get off . I use about 3 different makeup removers just to get this off . My eye area is too sensitive for that . I prefer the rare beauty one overall.
1738781940-947,https://www.sephora.com/product/fenty-hella-thicc-volumizing-mascara-P505055?skuId=2656130&icid2=products%20grid:p505055:product,1.2K,https://www.sephora.com/product/fenty-hella-thicc-volumizing-mascara-P505055?skuId=2656130&icid2=products%20grid:p505055:product#ratings-reviews-container,,This product is named perfectly,29 Jul 2023,CooperE,I have purchased this mascara twice over the past several months and I am in love! I love how black it makes my lashes and gives a false lash effect. I can see myself repurchasing this mascara over and over!!
1738781940-948,https://www.sephora.com/product/fenty-hella-thicc-volumizing-mascara-P505055?skuId=2656130&icid2=products%20grid:p505055:product,1.2K,https://www.sephora.com/product/fenty-hella-thicc-volumizing-mascara-P505055?skuId=2656130&icid2=products%20grid:p505055:product#ratings-reviews-container,,,29 Jul 2023,lmarzella,"Clumps way to much, not sure if it’s the brush or the formula"
1738781940-949,https://www.sephora.com/product/fenty-hella-thicc-volumizing-mascara-P505055?skuId=2656130&icid2=products%20grid:p505055:product,1.2K,https://www.sephora.com/product/fenty-hella-thicc-volumizing-mascara-P505055?skuId=2656130&icid2=products%20grid:p505055:product#ratings-reviews-container,,,29 Jul 2023,Bdelite,It does give volume but it smudges and makes me look like a raccoon in an hour! Find myself always having to double check in the mirror and clean it up!
1738781940-950,https://www.sephora.com/product/fenty-hella-thicc-volumizing-mascara-P505055?skuId=2656130&icid2=products%20grid:p505055:product,1.2K,https://www.sephora.com/product/fenty-hella-thicc-volumizing-mascara-P505055?skuId=2656130&icid2=products%20grid:p505055:product#ratings-reviews-container,,My Everyday Staple!!! It's A Must Have,28 Jul 2023,MsChique84,"I absolutely love this mascara.... I received the trial and just had to purchase the full size...  it doesn't clump on my lashes, and when I was it off, it doesn't strip my lashes.... FENTY FAM!!! I  love their products!!!"
1738781940-951,https://www.sephora.com/product/fenty-hella-thicc-volumizing-mascara-P505055?skuId=2656130&icid2=products%20grid:p505055:product,1.2K,https://www.sephora.com/product/fenty-hella-thicc-volumizing-mascara-P505055?skuId=2656130&icid2=products%20grid:p505055:product#ratings-reviews-container,,Perfect Mascara Volume yes!!,28 Jul 2023,mamaaaaBear,"So I literally tried every mascara out there, this mascara is my top 2, I love the brush it’s perfect and the formula for the mascara stays on all day, volume yes and make your lashes look so long, love it :)"
1738781940-952,https://www.sephora.com/product/fenty-hella-thicc-volumizing-mascara-P505055?skuId=2656130&icid2=products%20grid:p505055:product,1.2K,https://www.sephora.com/product/fenty-hella-thicc-volumizing-mascara-P505055?skuId=2656130&icid2=products%20grid:p505055:product#ratings-reviews-container,,Looks like lash extensions,27 Jul 2023,AFoodie,"I don’t usually wear makeup at work. Occasionally I’ll do some mascara and some lip gloss. I bought this based on a recommendation from a Sephora employee and some of the ladies at work asked if I had gotten lash extensions. It’s incredibly thick and volumizing and it does look like lash extensions when I put it on. The only downside for me is that I can actually see my lashes in my peripheral because the product is so thick. I have not experienced any smudging so far after wearing for 3 days at work but I also haven’t been sweating heavily or anything. It does flake off a tiny bit (found 2 tiny flecks on my cheek one day). Easy to take off, don’t have to apply a lot. I think this is my new favorite and im giving up maybelline."
1738781940-953,https://www.sephora.com/product/fenty-hella-thicc-volumizing-mascara-P505055?skuId=2656130&icid2=products%20grid:p505055:product,1.2K,https://www.sephora.com/product/fenty-hella-thicc-volumizing-mascara-P505055?skuId=2656130&icid2=products%20grid:p505055:product#ratings-reviews-container,,Not worth the money,27 Jul 2023,BeccaW88,I’m trying so hard to like this mascara but it ain’t it. I curl my lashes and apply a light coat of Hella Thicc and it causes my lashes to drop and go back to being straight. First pic is Hella Thicc and second pic is Maybelline. The volumizing isn’t anything so anything special either. I’ll stick with my colossal curl bounce mascara from Maybelline. Save the money
1738781940-954,https://www.sephora.com/product/fenty-hella-thicc-volumizing-mascara-P505055?skuId=2656130&icid2=products%20grid:p505055:product,1.2K,https://www.sephora.com/product/fenty-hella-thicc-volumizing-mascara-P505055?skuId=2656130&icid2=products%20grid:p505055:product#ratings-reviews-container,,Good volume!,27 Jul 2023,sfsuperstar,It goes on clumpy but better with a mascara primer. I used the Lancôme mascara primer with it. Gives good volume definitely and I have no issues with it flaking or not lasting. I will probably repurchase.
1738781940-955,https://www.sephora.com/product/fenty-hella-thicc-volumizing-mascara-P505055?skuId=2656130&icid2=products%20grid:p505055:product,1.2K,https://www.sephora.com/product/fenty-hella-thicc-volumizing-mascara-P505055?skuId=2656130&icid2=products%20grid:p505055:product#ratings-reviews-container,,Just meh……,27 Jul 2023,Allimmk,Not good. Not bad. Just below average at a higher cost. My lashes are pretty good and this didn’t really do much for them. Just made them look darker and weighed them down.
1738781940-956,https://www.sephora.com/product/fenty-hella-thicc-volumizing-mascara-P505055?skuId=2656130&icid2=products%20grid:p505055:product,1.2K,https://www.sephora.com/product/fenty-hella-thicc-volumizing-mascara-P505055?skuId=2656130&icid2=products%20grid:p505055:product#ratings-reviews-container,,My go-to mascara,26 Jul 2023,lailaxvii,"It's perfect, it's long wear, and easy to take off at night. Looks like falsies, however I find it smudges when I put it on my bottom lashes."
1738781940-957,https://www.sephora.com/product/fenty-hella-thicc-volumizing-mascara-P505055?skuId=2656130&icid2=products%20grid:p505055:product,1.2K,https://www.sephora.com/product/fenty-hella-thicc-volumizing-mascara-P505055?skuId=2656130&icid2=products%20grid:p505055:product#ratings-reviews-container,,,25 Jul 2023,mzwave,Best mascara I’ve ever used. I was a tried & true Maybeline girl.
1738781940-958,https://www.sephora.com/product/fenty-hella-thicc-volumizing-mascara-P505055?skuId=2656130&icid2=products%20grid:p505055:product,1.2K,https://www.sephora.com/product/fenty-hella-thicc-volumizing-mascara-P505055?skuId=2656130&icid2=products%20grid:p505055:product#ratings-reviews-container,,Love it but so disappointing!,20 Jul 2023,beautguru17,"I absolutely love this mascara! It lifts and creates the fake lash look..however it smudges so bad!! I hope they come up with a better formulation for this or even a waterproof. It’s such a great volumizing  mascara, but needs much improvement. "
1738781940-959,https://www.sephora.com/product/fenty-hella-thicc-volumizing-mascara-P505055?skuId=2656130&icid2=products%20grid:p505055:product,1.2K,https://www.sephora.com/product/fenty-hella-thicc-volumizing-mascara-P505055?skuId=2656130&icid2=products%20grid:p505055:product#ratings-reviews-container,,very voluminous,19 Jul 2023,morganms,this actually became my new favorite mascara right next to the tarte one. it adds a lot of volume to your lashes
1738781940-960,https://www.sephora.com/product/fenty-hella-thicc-volumizing-mascara-P505055?skuId=2656130&icid2=products%20grid:p505055:product,1.2K,https://www.sephora.com/product/fenty-hella-thicc-volumizing-mascara-P505055?skuId=2656130&icid2=products%20grid:p505055:product#ratings-reviews-container,,,17 Jul 2023,kd1089,This mascara smudges so easily. Very disappointing.
1738781940-961,https://www.sephora.com/product/fenty-hella-thicc-volumizing-mascara-P505055?skuId=2656130&icid2=products%20grid:p505055:product,1.2K,https://www.sephora.com/product/fenty-hella-thicc-volumizing-mascara-P505055?skuId=2656130&icid2=products%20grid:p505055:product#ratings-reviews-container,,Tried to love but no,15 Jul 2023,lbakos,"I am always looking for a great mascara since Sephora stopped making their Outrageous Volume mascara. I was really looking forward to Hella Thicc. I tried hard to love this, but unfortunately I ended up returning it. No matter what I did, after about 2 hours, I had a raccoon type look going on. The mascara would bleed onto my eyelids just under my eyebrows. Completely unacceptable as this made me look ridiculous"
1738781940-962,https://www.sephora.com/product/fenty-hella-thicc-volumizing-mascara-P505055?skuId=2656130&icid2=products%20grid:p505055:product,1.2K,https://www.sephora.com/product/fenty-hella-thicc-volumizing-mascara-P505055?skuId=2656130&icid2=products%20grid:p505055:product#ratings-reviews-container,,,14 Jul 2023,andylynne,"Beautifully thick and made my lashes look great, but the formula melted under my eyes significantly."
1738781940-963,https://www.sephora.com/product/fenty-hella-thicc-volumizing-mascara-P505055?skuId=2656130&icid2=products%20grid:p505055:product,1.2K,https://www.sephora.com/product/fenty-hella-thicc-volumizing-mascara-P505055?skuId=2656130&icid2=products%20grid:p505055:product#ratings-reviews-container,,must have,12 Jul 2023,chonguita,i really love this product gives my eyelashes volume
1738781940-964,https://www.sephora.com/product/fenty-hella-thicc-volumizing-mascara-P505055?skuId=2656130&icid2=products%20grid:p505055:product,1.2K,https://www.sephora.com/product/fenty-hella-thicc-volumizing-mascara-P505055?skuId=2656130&icid2=products%20grid:p505055:product#ratings-reviews-container,,A must have! Will buy again.,12 Jul 2023,KaylaNicole2424,"I actually love this. I was someone who had been getting lash extensions for years and recently stopped almost a year ago. So I’ve been letting my lashes grow. This mascara really makes them
Look long and full. I’m so happy I got it"
1738781940-965,https://www.sephora.com/product/fenty-hella-thicc-volumizing-mascara-P505055?skuId=2656130&icid2=products%20grid:p505055:product,1.2K,https://www.sephora.com/product/fenty-hella-thicc-volumizing-mascara-P505055?skuId=2656130&icid2=products%20grid:p505055:product#ratings-reviews-container,,Not for me,12 Jul 2023,Jessicavasq,"I was really excited for this product. During initial application, it’s beautiful but not even 30 minutes later it looked like I had two black eyes. Smudges really bad. Will return"
1738781940-966,https://www.sephora.com/product/fenty-hella-thicc-volumizing-mascara-P505055?skuId=2656130&icid2=products%20grid:p505055:product,1.2K,https://www.sephora.com/product/fenty-hella-thicc-volumizing-mascara-P505055?skuId=2656130&icid2=products%20grid:p505055:product#ratings-reviews-container,,Another win for Rih,6 Jul 2023,Oluboom,"I was really skeptical because of the reviews I read about smudging and smearing but I didn't experience that with this product. So far I absolutely love it. My favorite part is it doesn't dry hard. ALL the other mascaras I've used like Better than sex, Bad gyal Bang, Roller lash ... you name it , they ALL make my lashes crispy and they're so hard to remove with makeup wipes but this dries so softly and wipes off with the wipes. I absolutely love that part and for THAT reason this will be my new go to."
1738781940-967,https://www.sephora.com/product/fenty-hella-thicc-volumizing-mascara-P505055?skuId=2656130&icid2=products%20grid:p505055:product,1.2K,https://www.sephora.com/product/fenty-hella-thicc-volumizing-mascara-P505055?skuId=2656130&icid2=products%20grid:p505055:product#ratings-reviews-container,,Disappointing,6 Jul 2023,justbeachy18,"So disappointed, it smudges.  I had high hopes because Fenty is a quality brand but another disappointing mascara, why did Makeup Forever discontinue Excessive lash??"
1738781940-968,https://www.sephora.com/product/fenty-hella-thicc-volumizing-mascara-P505055?skuId=2656130&icid2=products%20grid:p505055:product,1.2K,https://www.sephora.com/product/fenty-hella-thicc-volumizing-mascara-P505055?skuId=2656130&icid2=products%20grid:p505055:product#ratings-reviews-container,,the perfect mascara.,5 Jul 2023,arterrt,idk why everyone’s hating. ive been trying almost every mascara both drugstore and high end and this is the best one by far. ive never stuck to just one mascara but this is one that i continue to repurchase
1738781940-969,https://www.sephora.com/product/fenty-hella-thicc-volumizing-mascara-P505055?skuId=2656130&icid2=products%20grid:p505055:product,1.2K,https://www.sephora.com/product/fenty-hella-thicc-volumizing-mascara-P505055?skuId=2656130&icid2=products%20grid:p505055:product#ratings-reviews-container,,Clumpy,5 Jul 2023,DiandraLynn,"Not a fan as it got clumpy fast. I prefer the original Fenty mascara. However, I will say that it was super pigmented!"
