FentyMascara,,,,,,,,
1738781940-566,https://www.sephora.com/product/fenty-hella-thicc-volumizing-mascara-P505055?skuId=2656130&icid2=products%20grid:p505055:product,1.2K,https://www.sephora.com/product/fenty-hella-thicc-volumizing-mascara-P505055?skuId=2656130&icid2=products%20grid:p505055:product#ratings-reviews-container,,good,31 Mar 2024,cassiecassie82,good mascara for thickness definitely just not for me.
1738781940-567,https://www.sephora.com/product/fenty-hella-thicc-volumizing-mascara-P505055?skuId=2656130&icid2=products%20grid:p505055:product,1.2K,https://www.sephora.com/product/fenty-hella-thicc-volumizing-mascara-P505055?skuId=2656130&icid2=products%20grid:p505055:product#ratings-reviews-container,,Fake or no..?,31 Mar 2024,Denmarkius,"It makes my eyelashes look so long, pretty and everyone I approach asked if I was wearing fake ones obsessed. Rihanna did great and I’m definitely restocking when I run out "
1738781940-568,https://www.sephora.com/product/fenty-hella-thicc-volumizing-mascara-P505055?skuId=2656130&icid2=products%20grid:p505055:product,1.2K,https://www.sephora.com/product/fenty-hella-thicc-volumizing-mascara-P505055?skuId=2656130&icid2=products%20grid:p505055:product#ratings-reviews-container,,Raccoon eyes!,29 Mar 2024,CathleenTash,I really wanted to like this mascara. It looks good and makes your lashes long but it gives raccoon eyes like no other mascara I’ve used.. I can’t even wear it to work because I look like a raccoon and have to keep wiping under my eyes. I’m so disappointed!
1738781940-569,https://www.sephora.com/product/fenty-hella-thicc-volumizing-mascara-P505055?skuId=2656130&icid2=products%20grid:p505055:product,1.2K,https://www.sephora.com/product/fenty-hella-thicc-volumizing-mascara-P505055?skuId=2656130&icid2=products%20grid:p505055:product#ratings-reviews-container,,Absolutely not,28 Mar 2024,kvanbur2,"I had a Sephora employee come up to me in store to ask what I was looking for... I told him I had been using and liking Lancôme Lash Idole but was tired of spending so much each time. He went on and on about how Rihanna's brand was so good for way less money, no flaking, good extension etc.

WHEN I TELL YOU I LOOKED LIKE A RACOON. 

like. every time i used it. no joke. this man mustve gotten a commission because this mascara is a hard pass. do not buy!"
1738781940-570,https://www.sephora.com/product/fenty-hella-thicc-volumizing-mascara-P505055?skuId=2656130&icid2=products%20grid:p505055:product,1.2K,https://www.sephora.com/product/fenty-hella-thicc-volumizing-mascara-P505055?skuId=2656130&icid2=products%20grid:p505055:product#ratings-reviews-container,,,27 Mar 2024,miikaw,"I love this mascara !
It’s really thick 
Makes your eyelashes look longer 
Highly recommended <3"
1738781940-571,https://www.sephora.com/product/fenty-hella-thicc-volumizing-mascara-P505055?skuId=2656130&icid2=products%20grid:p505055:product,1.2K,https://www.sephora.com/product/fenty-hella-thicc-volumizing-mascara-P505055?skuId=2656130&icid2=products%20grid:p505055:product#ratings-reviews-container,,A must have especially for long lashes!,25 Mar 2024,Presleysmama16,"These reviews of raccoon eyes have me baffled , how does it do that if it’s on your lashes ? Don’t put mascara on your skin. This is the best mascara I’ve used it’s perfect for long lashes , I absolutely love it !"
1738781940-572,https://www.sephora.com/product/fenty-hella-thicc-volumizing-mascara-P505055?skuId=2656130&icid2=products%20grid:p505055:product,1.2K,https://www.sephora.com/product/fenty-hella-thicc-volumizing-mascara-P505055?skuId=2656130&icid2=products%20grid:p505055:product#ratings-reviews-container,,Not suitable for dewy or oily skin,24 Mar 2024,mirandadawn,"I really wanted to like this product. But I ended up with raccoon eyes within the first hour of wear. I have dry to combination skin. But I enjoy wearing a more dewy look, so I don’t use a lot of powder. This product transfers the worst I have seen out of any product I have ever used. And I have tested a lot of mascaras. I do not recommend this product whatsoever."
1738781940-573,https://www.sephora.com/product/fenty-hella-thicc-volumizing-mascara-P505055?skuId=2656130&icid2=products%20grid:p505055:product,1.2K,https://www.sephora.com/product/fenty-hella-thicc-volumizing-mascara-P505055?skuId=2656130&icid2=products%20grid:p505055:product#ratings-reviews-container,,a must have mascara!,21 Mar 2024,jajae,been using this mascara for a few weeks and my lashes look long and lush. love it!
1738781940-574,https://www.sephora.com/product/fenty-hella-thicc-volumizing-mascara-P505055?skuId=2656130&icid2=products%20grid:p505055:product,1.2K,https://www.sephora.com/product/fenty-hella-thicc-volumizing-mascara-P505055?skuId=2656130&icid2=products%20grid:p505055:product#ratings-reviews-container,,A must have for me,17 Mar 2024,,After using the product it has left my eyelashes looking like they have grown
1738781940-575,https://www.sephora.com/product/fenty-hella-thicc-volumizing-mascara-P505055?skuId=2656130&icid2=products%20grid:p505055:product,1.2K,https://www.sephora.com/product/fenty-hella-thicc-volumizing-mascara-P505055?skuId=2656130&icid2=products%20grid:p505055:product#ratings-reviews-container,,"A must have, don’t sleep on it!!",15 Mar 2024,KiBey713,"Omg, I’m in luv!!! Do u hear me? When I tell u RiRi told no lie! Thicc th th thicc!!"
1738781940-576,https://www.sephora.com/product/fenty-hella-thicc-volumizing-mascara-P505055?skuId=2656130&icid2=products%20grid:p505055:product,1.2K,https://www.sephora.com/product/fenty-hella-thicc-volumizing-mascara-P505055?skuId=2656130&icid2=products%20grid:p505055:product#ratings-reviews-container,,,13 Mar 2024,smpyt,"It’s just ok. I really wanted to love this mascara, I gave a good try, unfortunately it’s not my cup of tea. It’s not long wearing and tends to dry out quickly."
1738781940-577,https://www.sephora.com/product/fenty-hella-thicc-volumizing-mascara-P505055?skuId=2656130&icid2=products%20grid:p505055:product,1.2K,https://www.sephora.com/product/fenty-hella-thicc-volumizing-mascara-P505055?skuId=2656130&icid2=products%20grid:p505055:product#ratings-reviews-container,,Favorite mascara by far ,12 Mar 2024,callielanae,Super super beautiful mascara make sure your lashes look so long and pretty!
1738781940-578,https://www.sephora.com/product/fenty-hella-thicc-volumizing-mascara-P505055?skuId=2656130&icid2=products%20grid:p505055:product,1.2K,https://www.sephora.com/product/fenty-hella-thicc-volumizing-mascara-P505055?skuId=2656130&icid2=products%20grid:p505055:product#ratings-reviews-container,,Must Have,10 Mar 2024,Ashleedawnn,I looooove this mascara! One layer and it makes my eyelashes look amazing! I don’t find it clumpy and it doesn’t irritate my eyes!
1738781940-579,https://www.sephora.com/product/fenty-hella-thicc-volumizing-mascara-P505055?skuId=2656130&icid2=products%20grid:p505055:product,1.2K,https://www.sephora.com/product/fenty-hella-thicc-volumizing-mascara-P505055?skuId=2656130&icid2=products%20grid:p505055:product#ratings-reviews-container,,Game changer if lashes arent your thing,8 Mar 2024,dhowla,This mascara is soo great! For one i love how black it is and how dramatic my eyes look. It makes your lashes look like falsies. But i will say that i do have semi long lashes so they make them super long.Its great for layering on top of other mascaras to make them more dramatic
1738781940-580,https://www.sephora.com/product/fenty-hella-thicc-volumizing-mascara-P505055?skuId=2656130&icid2=products%20grid:p505055:product,1.2K,https://www.sephora.com/product/fenty-hella-thicc-volumizing-mascara-P505055?skuId=2656130&icid2=products%20grid:p505055:product#ratings-reviews-container,,Best for Length & Volume,5 Mar 2024,Gabbyscott,Best mascara I’ve ever used! and I say this as someone who’s tried out the Too Faced better than sex and Benefit they are real mascara. This gives length and volume! + super easy to take off using an eye makeup remove
1738781940-581,https://www.sephora.com/product/fenty-hella-thicc-volumizing-mascara-P505055?skuId=2656130&icid2=products%20grid:p505055:product,1.2K,https://www.sephora.com/product/fenty-hella-thicc-volumizing-mascara-P505055?skuId=2656130&icid2=products%20grid:p505055:product#ratings-reviews-container,,SO good BUT...,5 Mar 2024,Justeve398,"I haven't been as in love with a mascara in so long...but it's a bittersweet love affair!! I adore how this mascara literally reaches and pulls out EVERY lash I never knew I had. It darkens, thickens, volumizes, extends, fans out, and lifts in one swipe! The bliss is short-lived however...I've never had a mascara transfer SO bad under my eyes. :( I can bet that every time I look in the mirror I will look like a raccoon. It messes up my whole look, EVERY day!!  I want to give this 5 stars SO BAD. Fenty, PLEASE fix this formula!! You'd have a true gem on your hands!!"
1738781940-582,https://www.sephora.com/product/fenty-hella-thicc-volumizing-mascara-P505055?skuId=2656130&icid2=products%20grid:p505055:product,1.2K,https://www.sephora.com/product/fenty-hella-thicc-volumizing-mascara-P505055?skuId=2656130&icid2=products%20grid:p505055:product#ratings-reviews-container,,,3 Mar 2024,shekbyindahouse,"Love the volume & thickness of my lashes when I first apply it. Unfortunately it smudges. Even applying to top lashes only, it still left me with transfer under the eye."
1738781940-583,https://www.sephora.com/product/fenty-hella-thicc-volumizing-mascara-P505055?skuId=2656130&icid2=products%20grid:p505055:product,1.2K,https://www.sephora.com/product/fenty-hella-thicc-volumizing-mascara-P505055?skuId=2656130&icid2=products%20grid:p505055:product#ratings-reviews-container,,Lives Up to The Name,3 Mar 2024,Taiyari,"This mascara lives up to its name. It’s thick to the point where I have to clean some off the brush before application. If I don’t, it’ll clump and look awful. It’s so hard to remove and leaves residue which makes my eyes look dark."
1738781940-584,https://www.sephora.com/product/fenty-hella-thicc-volumizing-mascara-P505055?skuId=2656130&icid2=products%20grid:p505055:product,1.2K,https://www.sephora.com/product/fenty-hella-thicc-volumizing-mascara-P505055?skuId=2656130&icid2=products%20grid:p505055:product#ratings-reviews-container,,Unfortunately no,3 Mar 2024,Erikasversion,I loved how long my eye lashes were but the mascara dust was bad. Looked like a raccoon😞
1738781940-585,https://www.sephora.com/product/fenty-hella-thicc-volumizing-mascara-P505055?skuId=2656130&icid2=products%20grid:p505055:product,1.2K,https://www.sephora.com/product/fenty-hella-thicc-volumizing-mascara-P505055?skuId=2656130&icid2=products%20grid:p505055:product#ratings-reviews-container,,"Ruined my own lashes, bad packaging",28 Feb 2024,,One of the worst mascaras I have ever used. Bottle can’t stand up straight on the bathroom counter. Makes your lashes both clumpy AND spidery at the same time? Gets all over your lids.
1738781940-586,https://www.sephora.com/product/fenty-hella-thicc-volumizing-mascara-P505055?skuId=2656130&icid2=products%20grid:p505055:product,1.2K,https://www.sephora.com/product/fenty-hella-thicc-volumizing-mascara-P505055?skuId=2656130&icid2=products%20grid:p505055:product#ratings-reviews-container,,Made my natural lashes fall out,28 Feb 2024,ihatethisssssss,I received this by using my rewards points and wanted to like it but it made my long lashes shrivel and lashes fall out. I had a large chunk of space empty when normally have nice lashes. I immediately stopped using after noticing now my lashes are growing back. I do not recommend this product.
1738781940-587,https://www.sephora.com/product/fenty-hella-thicc-volumizing-mascara-P505055?skuId=2656130&icid2=products%20grid:p505055:product,1.2K,https://www.sephora.com/product/fenty-hella-thicc-volumizing-mascara-P505055?skuId=2656130&icid2=products%20grid:p505055:product#ratings-reviews-container,,Always a must have In my makeup routine! The best!,25 Feb 2024,kbueaty33,The best mascara ever. My lashes uncurl so fast but with this mascara it looks like I have fake lashes on all day. I let my friends use it and then went and bought it. Wonderful product.
1738781940-588,https://www.sephora.com/product/fenty-hella-thicc-volumizing-mascara-P505055?skuId=2656130&icid2=products%20grid:p505055:product,1.2K,https://www.sephora.com/product/fenty-hella-thicc-volumizing-mascara-P505055?skuId=2656130&icid2=products%20grid:p505055:product#ratings-reviews-container,,"Love this, but….",24 Feb 2024,chrisdm,"I absolutely love the look this mascara gives! 
The only thing preventing me from giving it a 5⭐️
Is the transfer! You have to constantly check and clean the smudges."
1738781940-589,https://www.sephora.com/product/fenty-hella-thicc-volumizing-mascara-P505055?skuId=2656130&icid2=products%20grid:p505055:product,1.2K,https://www.sephora.com/product/fenty-hella-thicc-volumizing-mascara-P505055?skuId=2656130&icid2=products%20grid:p505055:product#ratings-reviews-container,,"Good price, good mascar",21 Feb 2024,kittybear,"I really like mascara, it separates and lengthens my lashes so well! My only dislike is that I do have to check for light transfer under my eyes after a while. It cleans up easily, and I just add a bit of powder after. My holy grail mascara was made by a brand called Prescriptives, and their Beyond Long mascara was the GOAT. I still haven’t found a mascara as good as that, but the search continues. 

In the mean time I’ll keep using this bc it does work well; lashes get length and fullness from this mascara. The application of this mascara is close to Beyond Long, but the transfer issue means it’s still not a replacement. I will buy this again."
1738781940-590,https://www.sephora.com/product/fenty-hella-thicc-volumizing-mascara-P505055?skuId=2656130&icid2=products%20grid:p505055:product,1.2K,https://www.sephora.com/product/fenty-hella-thicc-volumizing-mascara-P505055?skuId=2656130&icid2=products%20grid:p505055:product#ratings-reviews-container,,LOVE!,20 Feb 2024,Juniper6278,"I received a sample& was so surprised- I love it! My go to mascaras have always been Too Faced "" Better than sex""& It "" Superhero"".  I love this just as much or maybe a little more- will definitely be purchasing full size!"
1738781940-591,https://www.sephora.com/product/fenty-hella-thicc-volumizing-mascara-P505055?skuId=2656130&icid2=products%20grid:p505055:product,1.2K,https://www.sephora.com/product/fenty-hella-thicc-volumizing-mascara-P505055?skuId=2656130&icid2=products%20grid:p505055:product#ratings-reviews-container,,,7 Feb 2024,Bluecil,"I loved the sample of this mascara, so I was excited to get the full size. I really want to like it but the application is inconsistent. Sometimes it goes on clumpy seemingly from too much mascara and other times it doesn’t. I’m not sure if this has to do with the formula or the brush."
1738781940-592,https://www.sephora.com/product/fenty-hella-thicc-volumizing-mascara-P505055?skuId=2656130&icid2=products%20grid:p505055:product,1.2K,https://www.sephora.com/product/fenty-hella-thicc-volumizing-mascara-P505055?skuId=2656130&icid2=products%20grid:p505055:product#ratings-reviews-container,,,6 Feb 2024,Lucethel,Worst mascara. Ever. Covergirl and even dollar store mascara is better then this. Waste of money.
1738781940-593,https://www.sephora.com/product/fenty-hella-thicc-volumizing-mascara-P505055?skuId=2656130&icid2=products%20grid:p505055:product,1.2K,https://www.sephora.com/product/fenty-hella-thicc-volumizing-mascara-P505055?skuId=2656130&icid2=products%20grid:p505055:product#ratings-reviews-container,,,6 Feb 2024,agusbrenmonzon,Love this product bc i love how my eyelashes look but i it seams a litle too moist and u have to take the excedent out bc ur lashes are gonna look  over make up
1738781940-594,https://www.sephora.com/product/fenty-hella-thicc-volumizing-mascara-P505055?skuId=2656130&icid2=products%20grid:p505055:product,1.2K,https://www.sephora.com/product/fenty-hella-thicc-volumizing-mascara-P505055?skuId=2656130&icid2=products%20grid:p505055:product#ratings-reviews-container,,Super good,5 Feb 2024,hannahxox5,"I love this mascara so much, i wear it all the time and it makes my eyelashes look so good."
1738781940-595,https://www.sephora.com/product/fenty-hella-thicc-volumizing-mascara-P505055?skuId=2656130&icid2=products%20grid:p505055:product,1.2K,https://www.sephora.com/product/fenty-hella-thicc-volumizing-mascara-P505055?skuId=2656130&icid2=products%20grid:p505055:product#ratings-reviews-container,,Love this! 🤍,4 Feb 2024,cmfitzpatrick,"Love this mascara! It makes my lashes look so long and thick! My only complaint is that it’s a bit clumpy, but it’s easy to fix. Totally recommend!"
1738781940-596,https://www.sephora.com/product/fenty-hella-thicc-volumizing-mascara-P505055?skuId=2656130&icid2=products%20grid:p505055:product,1.2K,https://www.sephora.com/product/fenty-hella-thicc-volumizing-mascara-P505055?skuId=2656130&icid2=products%20grid:p505055:product#ratings-reviews-container,,Raccoon Eyes,2 Feb 2024,Se4aLvr,"This mascara has never failed to flake and smudge. By the time I’m ready to take it off, I look like a raccoon. Throwing his in the trash and going back to my tried and true Thrive tubing mascara."
1738781940-597,https://www.sephora.com/product/fenty-hella-thicc-volumizing-mascara-P505055?skuId=2656130&icid2=products%20grid:p505055:product,1.2K,https://www.sephora.com/product/fenty-hella-thicc-volumizing-mascara-P505055?skuId=2656130&icid2=products%20grid:p505055:product#ratings-reviews-container,,Basically sitting in my makeup drawer.,31 Jan 2024,JustAle,I really wanted to like it but it’s not worth the money. The formula is clumpy and my lashes fall right after I apply it. So far worst mascara I have ever tried. The packaging feels like cheap plastic as well. Save your money.
1738781940-598,https://www.sephora.com/product/fenty-hella-thicc-volumizing-mascara-P505055?skuId=2656130&icid2=products%20grid:p505055:product,1.2K,https://www.sephora.com/product/fenty-hella-thicc-volumizing-mascara-P505055?skuId=2656130&icid2=products%20grid:p505055:product#ratings-reviews-container,,Terrible,29 Jan 2024,SBose88,I have decently thick lashes but this mascara makes them stick together and look sparse. The formula is watery and doesn’t thicken or lengthen. Don’t waste your money!
1738781940-599,https://www.sephora.com/product/fenty-hella-thicc-volumizing-mascara-P505055?skuId=2656130&icid2=products%20grid:p505055:product,1.2K,https://www.sephora.com/product/fenty-hella-thicc-volumizing-mascara-P505055?skuId=2656130&icid2=products%20grid:p505055:product#ratings-reviews-container,,Save Your Money,27 Jan 2024,sunstreaked27,Most disappointing mascara I’ve tried in a while. The length & volume was subpar. Bad separation. Dries crusty and flakes. There are much better drugstore mascaras and better products from Fenty.
1738781940-600,https://www.sephora.com/product/fenty-hella-thicc-volumizing-mascara-P505055?skuId=2656130&icid2=products%20grid:p505055:product,1.2K,https://www.sephora.com/product/fenty-hella-thicc-volumizing-mascara-P505055?skuId=2656130&icid2=products%20grid:p505055:product#ratings-reviews-container,,,26 Jan 2024,brie1598,"I saw so many good things about this, but I really didn’t like this on me. It was super clumpy on me. I like the other fenty mascara better."
1738781940-601,https://www.sephora.com/product/fenty-hella-thicc-volumizing-mascara-P505055?skuId=2656130&icid2=products%20grid:p505055:product,1.2K,https://www.sephora.com/product/fenty-hella-thicc-volumizing-mascara-P505055?skuId=2656130&icid2=products%20grid:p505055:product#ratings-reviews-container,,Must have!,26 Jan 2024,Riverjaden23,"I bought this because my friend has it, and when I used it I fell in love. It gives my lashes such length, and my lashes look thick although it doesn’t hold a curl it does last all day. "
1738781940-602,https://www.sephora.com/product/fenty-hella-thicc-volumizing-mascara-P505055?skuId=2656130&icid2=products%20grid:p505055:product,1.2K,https://www.sephora.com/product/fenty-hella-thicc-volumizing-mascara-P505055?skuId=2656130&icid2=products%20grid:p505055:product#ratings-reviews-container,,,25 Jan 2024,jocelynShairi,"Love this! I got the mini version and bro it’s AMAZING, works so good on my lashes and makes them really long!"
1738781940-603,https://www.sephora.com/product/fenty-hella-thicc-volumizing-mascara-P505055?skuId=2656130&icid2=products%20grid:p505055:product,1.2K,https://www.sephora.com/product/fenty-hella-thicc-volumizing-mascara-P505055?skuId=2656130&icid2=products%20grid:p505055:product#ratings-reviews-container,,Best Mascara!,25 Jan 2024,hushbabbyyy,One of the best mascaras I’ve used let me tell you just get it an it’s not waterproof so it doesn’t damage the eyelashes
1738781940-604,https://www.sephora.com/product/fenty-hella-thicc-volumizing-mascara-P505055?skuId=2656130&icid2=products%20grid:p505055:product,1.2K,https://www.sephora.com/product/fenty-hella-thicc-volumizing-mascara-P505055?skuId=2656130&icid2=products%20grid:p505055:product#ratings-reviews-container,,,25 Jan 2024,PURPLEDAISEE,Purchased as Christmas stocking gift. It was very well appreciated!
1738781940-605,https://www.sephora.com/product/fenty-hella-thicc-volumizing-mascara-P505055?skuId=2656130&icid2=products%20grid:p505055:product,1.2K,https://www.sephora.com/product/fenty-hella-thicc-volumizing-mascara-P505055?skuId=2656130&icid2=products%20grid:p505055:product#ratings-reviews-container,,A must have for sensitive eyes!,25 Jan 2024,kumpir,"The only mascara that doesn’t hurt my eyes!! I have a very sensitive eye and this one works great, thickens my lashes perfectly. Love it much"
1738781940-606,https://www.sephora.com/product/fenty-hella-thicc-volumizing-mascara-P505055?skuId=2656130&icid2=products%20grid:p505055:product,1.2K,https://www.sephora.com/product/fenty-hella-thicc-volumizing-mascara-P505055?skuId=2656130&icid2=products%20grid:p505055:product#ratings-reviews-container,,Don't buy!,22 Jan 2024,Zeldathewarrior,"This is the worst mascara, please don't buy it and waste your money even Elf has better mascara! It's so clumpy and just thick and just so ugly i hate it what waste of money.."
1738781940-607,https://www.sephora.com/product/fenty-hella-thicc-volumizing-mascara-P505055?skuId=2656130&icid2=products%20grid:p505055:product,1.2K,https://www.sephora.com/product/fenty-hella-thicc-volumizing-mascara-P505055?skuId=2656130&icid2=products%20grid:p505055:product#ratings-reviews-container,,volumizing and leghtening,22 Jan 2024,ZaraMm,"this is such a good mascara!! volumizing and lengthening - kind of hard to take if though, but otherwise 10/10!!"
1738781940-608,https://www.sephora.com/product/fenty-hella-thicc-volumizing-mascara-P505055?skuId=2656130&icid2=products%20grid:p505055:product,1.2K,https://www.sephora.com/product/fenty-hella-thicc-volumizing-mascara-P505055?skuId=2656130&icid2=products%20grid:p505055:product#ratings-reviews-container,,Must have for short sparse lashes,21 Jan 2024,HiHoSilver,I love this product because it makes my short sparse lashes stand out and look full. Before this I used Lancôme Monsieur Big Mascara (for a long time). I have gone through 2 tubes and never disappointed. Try it out. I hope you love it too!
1738781940-609,https://www.sephora.com/product/fenty-hella-thicc-volumizing-mascara-P505055?skuId=2656130&icid2=products%20grid:p505055:product,1.2K,https://www.sephora.com/product/fenty-hella-thicc-volumizing-mascara-P505055?skuId=2656130&icid2=products%20grid:p505055:product#ratings-reviews-container,,Its a NO! Unless you're going for the rough look,21 Jan 2024,12Gina,"At first I was in love with how my lashes looked. After 5 uses this mascara will make your lashes clump, leaves so much product on them,  your lashes will stick together and will not separate when brushing with the wand, and overall looks like you had a rough night prior to even leaving your house. Removing the wand from the tube will have so much buildup of product.  I wish I could return and get my money back. This mascara is awful."
1738781940-610,https://www.sephora.com/product/fenty-hella-thicc-volumizing-mascara-P505055?skuId=2656130&icid2=products%20grid:p505055:product,1.2K,https://www.sephora.com/product/fenty-hella-thicc-volumizing-mascara-P505055?skuId=2656130&icid2=products%20grid:p505055:product#ratings-reviews-container,,,20 Jan 2024,marlssd,I do not like it. Made my lashes fall as soon as I put it on and very clumpy. Very disappointed because I love so many of Fenty’s other products.
1738781940-611,https://www.sephora.com/product/fenty-hella-thicc-volumizing-mascara-P505055?skuId=2656130&icid2=products%20grid:p505055:product,1.2K,https://www.sephora.com/product/fenty-hella-thicc-volumizing-mascara-P505055?skuId=2656130&icid2=products%20grid:p505055:product#ratings-reviews-container,,A MUST in your lash routine!! 100000/10,20 Jan 2024,mya2746,I have never used this brand before and let me tell you when I used this product I had the instant urge to buy 20 more things from this brand!! It left my lashes SUPER long and thick!! One coat is truly all you need!
1738781940-612,https://www.sephora.com/product/fenty-hella-thicc-volumizing-mascara-P505055?skuId=2656130&icid2=products%20grid:p505055:product,1.2K,https://www.sephora.com/product/fenty-hella-thicc-volumizing-mascara-P505055?skuId=2656130&icid2=products%20grid:p505055:product#ratings-reviews-container,,"Tammy Faye Baker Lashes, Here I come.",19 Jan 2024,Warflowers,"This clumps so bad! It is also hard to distribute through long lashes. In addition, it has minor fallout. Does remove easily, which is nice. I cannot recommend this product."
